Filename,Transcript
d1082_2-TLI_0,also er hat aber immer wieder ein klein können schaffen
d1082_2-TLI_1,also so einer ist allmal noch
d1082_2-TLI_10,und das ist die zeit gewesen
d1082_2-TLI_101,kann ich weiterreden
d1082_2-TLI_102,es hat sogar noch
d1082_2-TLI_103,bekannte gegeben in unserer umgebung
d1082_2-TLI_104,wo wir gewohnt haben wo es noch schwerer gehabt haben alles meine mutter
d1082_2-TLI_105,wo noch eine arbeitslosen mann gehabt haben
d1082_2-TLI_106,und und vielleicht drei kinder
d1082_2-TLI_107,die haben das noch schwerer gehabt
d1082_2-TLI_108,hat ihre mutter noch ein zweites mal geheiratet
d1082_2-TLI_109,nein nein sie hat nicht mehr geheiratet
d1082_2-TLI_110,sie ist ihre mutter dann auch
d1082_2-TLI_111,ja politisch engagiert gewesen in der arbeiterbewegung
d1082_2-TLI_112,oder ihre geschwister aufgerund jetzt von ihrem schicksal
d1082_2-TLI_113,also also von meinem halbbruder
d1082_2-TLI_114,weiss ich dass er auch bei den roten falken gewesen ist
d1082_2-TLI_115,was heisst auch
d1082_2-TLI_116,ja wie ich also
d1082_2-TLI_117,ich später natürlich dann in der also anfangs vierzigerjahren
d1082_2-TLI_118,und er natürlich viel früher wo sie im entstehe gewesen ist
d1082_2-TLI_119,es ist ihm in den zwanzigerjahren im entstehe gewesen
d1082_2-TLI_12,nein also er ist dann
d1082_2-TLI_120,können sie etwas über die roten falken verzählen
d1082_2-TLI_122,es ist so gewesen
d1082_2-TLI_123,das ich eigentlich in meinem leben
d1082_2-TLI_124,also in meiner jugend zum beispiel
d1082_2-TLI_125,in der kirche ist es mir immer grauenhaft langweilig gewesen
d1082_2-TLI_126,und das ist etwas gewesen wo ich gefunden habe mit dem kann ich überhaupt gar nichts anfangen
d1082_2-TLI_127,und dann
d1082_2-TLI_128,bin ich ungefähr in der sechsten klasse
d1082_2-TLI_129,bin ich gewesen ich könnte das nicht mehr genau sagen
d1082_2-TLI_13,mehrere mal im spital gewesen
d1082_2-TLI_130,hat mich eine schulkollegin einmal mitgenommen zu den roten falken
d1082_2-TLI_131,und dann sind
d1082_2-TLI_132,das ist ungefähr neunzehnhunderteinundvierzig gewesen so
d1082_2-TLI_133,und dann habe ich habe ich die lieder gehört wo man da gesungen haben
d1082_2-TLI_134,und dann habe ich gefunden das ist es das ist eine initialzündung gewesen
d1082_2-TLI_135,das ist es jetzt genau das ist das wo mir fehlt
d1082_2-TLI_136,und dann meine mutter hat noch gefunden
d1082_2-TLI_137,wohl das sei eigentlich noch eine gute sache also sie hat dann
d1082_2-TLI_138,das befeuerwartet das hat sie
d1082_2-TLI_139,sie ist zwar nicht politisch aber sie ist im fallbehehensos-dor gewesen
d1082_2-TLI_14,und der arzt haben einfach gemerkt dass sie einem nicht mehr können helfen
d1082_2-TLI_140,und am ersten mai mitgelaufen und also aber sonst politisch sie hat
d1082_2-TLI_141,also sie hat wirklich sozusagen keine zeit gehabt
d1082_2-TLI_142,und auch auch gar keine vorbildung
d1082_2-TLI_143,also überhaupt nicht ja
d1082_2-TLI_145,institution gewesen
d1082_2-TLI_146,es ist tragen gewesen ist es von den soziaaldemokraatische partei
d1082_2-TLI_147,aber wir haben natürlich auch kommunistische lieder gesungen
d1082_2-TLI_148,und es hat auch
d1082_2-TLI_149,kommunistische einfluss gewesen und wir sind ganz nach
d1082_2-TLI_15,das blut ist nicht mehr gut gewesen
d1082_2-TLI_150,russland ausgerichtet gewesen
d1082_2-TLI_151,obwohl ja die zeit gewesen ist von denen amerikanis ein eigentlich
d1082_2-TLI_152,also schon und von man ist eigentlich nicht gerade
d1082_2-TLI_153,ja also beliebt nicht beliebt es ist
d1082_2-TLI_154,das ist unpassend gewesen dann
d1082_2-TLI_155,meistens von den roten falken
d1082_2-TLI_156,es ist etwas gewesen wo nicht so in die zeit gepasst hat
d1082_2-TLI_157,in in der schweiz ist man ja das ziemlich nazifreundlich gewesen
d1082_2-TLI_158,so in der anfangs von der vierzigerjahren
d1082_2-TLI_159,was haben sie genau an denen veranstaltungen gemacht
d1082_2-TLI_16,und es ist dann auf die lebern gegangen und
d1082_2-TLI_160,an denen veranstaltungen
d1082_2-TLI_161,da haben wir
d1082_2-TLI_162,ja wir haben so veranstaltungen gehabt zum beispiel im volkshaus
d1082_2-TLI_163,und dann sind volkstänze getanzt worden
d1082_2-TLI_164,man haben auch kleine schauspiel aufgeführt
d1082_2-TLI_165,und wir haben natürlich eben die politischer lieder gesungen
d1082_2-TLI_166,man haben auch an veranstaltungen von den soziaaldemokraatische partei sind wir zuerst
d1082_2-TLI_167,kommen und haben so ein lied gesungen
d1082_2-TLI_168,und wir haben auch man haben natürlich eben die roten
d1082_2-TLI_169,kampftüchlein gehabt wir sind am ersten mai zu vorderst mitgelaufen
d1082_2-TLI_17,also wo man ein seziert hat ist das leberei und magenkrebs gewesen
d1082_2-TLI_170,wir haben die sturmfahnen gehabt
d1082_2-TLI_171,und wir haben also
d1082_2-TLI_172,ich habe ja dass da geschrieben wo wo wo mich
d1082_2-TLI_173,wo ich befragt worden bin
d1082_2-TLI_174,also es sind aber keine uniformen gewesen von den roten falken
d1082_2-TLI_175,es ist es blau hemd gewesen also wie wie die arbeiter das gehabt haben
d1082_2-TLI_176,keine abzeichen keine herarten
d1082_2-TLI_177,kein einzelkämpfertum
d1082_2-TLI_178,man hat sich wollen abheben von den übrigen
d1082_2-TLI_179,politisch angehauchten jugendorganisationen zum beispiel der pfadfinder
d1082_2-TLI_18,und an dem ist er gestorben und dort hat man anscheinander zu selbiger zeit
d1082_2-TLI_180,wie sind dann die pfadfinder politisch angehaucht gewesen dass
d1082_2-TLI_182,also die pfadfinder haben eine totale herarten gehabt
d1082_2-TLI_183,also wir haben das zwar auch ein klein
d1082_2-TLI_184,man haben auch ein klein leichte herarten gehabt zum beispiel hat es gegeben nestfalken
d1082_2-TLI_185,jungefalken rotfalken sturmfalken
d1082_2-TLI_186,ab wann hat man können eingetreten
d1082_2-TLI_187,ja das haben wir schon
d1082_2-TLI_188,das haben wir schon vierjährige gehabt
d1082_2-TLI_189,also wo man einfach mitgezogen haben
d1082_2-TLI_19,ja er ist auch fast wie verhungert
d1082_2-TLI_190,und dann haben wir unser haus gehabt
d1082_2-TLI_191,das ist das möslein gewesen
d1082_2-TLI_192,wo ist das gestanden
d1082_2-TLI_193,das steht heute noch
d1082_2-TLI_194,und das das ist
d1082_2-TLI_195,in der bucheneck
d1082_2-TLI_196,und dort haben wir unsere
d1082_2-TLI_197,ja unsere wochenende gehabt
d1082_2-TLI_198,und haben selber gekocht
d1082_2-TLI_199,und das ist was natürlich ganz grossartig gewesen ist
d1082_2-TLI_2,froh gewesen dass er arbeitslos gewesen ist
d1082_2-TLI_20,er hat auch auch fast nichts mehr gegessen
d1082_2-TLI_200,buben und mädchen sind nicht getrennt gewesen
d1082_2-TLI_201,haben auch nicht auch nicht getrennt geschlafen
d1082_2-TLI_202,also mehr haben schon einen blauen saal gehabt und einen roten
d1082_2-TLI_203,aber man hat eineinlich im gleichen saal geschlafen
d1082_2-TLI_204,und unser inspirator
d1082_2-TLI_205,oder spiritus rektor das ist dann gerhold meier gewesen einen lehrer
d1082_2-TLI_206,und wir haben
d1082_2-TLI_207,dort in der umgebung
d1082_2-TLI_208,haben wir dann auch voraussen kochstellen gebaut
d1082_2-TLI_209,die mädelein haben auch dürfen kochstelle bauen und für machen
d1082_2-TLI_21,und ich weiss nur dass er daheim gestorben ist
d1082_2-TLI_210,und man haben dürfen morgen
d1082_2-TLI_211,man hat dürfen an der sportveranstaltungen
d1082_2-TLI_212,genau gleich mitmachen
d1082_2-TLI_213,die buben haben aber auch müssen kochen und putzen
d1082_2-TLI_214,es ist ganz alle haben das gleiche gemacht
d1082_2-TLI_215,gleichstellung und
d1082_2-TLI_216,man hat auch miteinander geduscht
d1082_2-TLI_217,also die buben und die mädchen und einen freien körper immer freien
d1082_2-TLI_218,einen freien geist in einem freien körper
d1082_2-TLI_219,und ich also dann gerhold meier ist zugleich noch
d1082_2-TLI_22,mögen sie sich noch an sein tod erinnern
d1082_2-TLI_220,er ist ein lehrer gewesen und zugleich noch heilpädagoge
d1082_2-TLI_221,ich habe grossartige erinnerungen an der mann
d1082_2-TLI_222,und dann ist uns auch eingescherft worden
d1082_2-TLI_223,die sorgfaltspflicht man geht mit allem ganz sorgfältig um
d1082_2-TLI_224,und die natur und die tiere das ist gleichwertig wie der mensch
d1082_2-TLI_225,es ist also nicht so dass wir
d1082_2-TLI_226,die krone der schöpfung sind so in dem stil
d1082_2-TLI_227,und da
d1082_2-TLI_228,das sind die gebolten das ist da
d1082_2-TLI_229,die falkengeboten
d1082_2-TLI_23,ja ich mag mich auch sein tod erinnern
d1082_2-TLI_230,also wir haben gehabt der roten falken ist ein freund und schützer der natur
d1082_2-TLI_231,wo noch praktisch kein mensch von naturschutz geredet hat
d1082_2-TLI_232,das ist das und also dass
d1082_2-TLI_233,das haus das möslein das ist
d1082_2-TLI_234,als fronarbeit gebaut worden
d1082_2-TLI_235,das ist neunzehnhunderteinunddreissig ist es fertig gebaut gewesen oder neunzehnhundertzweiunddreissig
d1082_2-TLI_236,das ist von eben von arbeitslosen ist das gebaut worden
d1082_2-TLI_237,und ich weiss das eben mein halbbruder
d1082_2-TLI_238,auch mitgebaut hat auch so häuser auch naturfreundehäuser
d1082_2-TLI_239,das ist so ist das ist das gebaut worden
d1082_2-TLI_24,also drei wochen
d1082_2-TLI_240,es hat auch viel arbeitslose lehrer gehabt in der zeit
d1082_2-TLI_241,wo mitgeschafft haben
d1082_2-TLI_242,und das möslein das gibt es heute noch
d1082_2-TLI_243,der freundeskreis müsslich ich weiss nicht ob sie das kennen
d1082_2-TLI_244,und ich bin ich bin dann
d1082_2-TLI_245,ja ich bin mehrere jahre
d1082_2-TLI_246,also kassiererin gewesen jetzt habe ich das amt einmal aufgegeben
d1082_2-TLI_247,und zwischeninhin ist es auch einmal eingeschlafen gewesen
d1082_2-TLI_248,der freundeskreis möslein wie es so ist
d1082_2-TLI_249,dann im unterschied zu anderen jugendorganisationen wie die pfaden
d1082_2-TLI_25,vor der gestorben ist
d1082_2-TLI_253,ja das dort weiss ich jetzt nicht
d1082_2-TLI_256,das heisst
d1082_2-TLI_258,sind da bei den roten falken gewesen
d1082_2-TLI_26,ist fast alle tage eine krankenschwester gekommen
d1082_2-TLI_260,also sportliche alles
d1082_2-TLI_261,ich mag mich noch vor allem erinnern
d1082_2-TLI_262,wir haben ferienlager gehabt in magglingen drei wochen
d1082_2-TLI_263,also das ist natürlich nur national gewesen leider nicht international
d1082_2-TLI_264,das ist neunzehnhundertdreiundvierzig neunzehnhundertvierundvierzig gewesen
d1082_2-TLI_265,also da haben wir so
d1082_2-TLI_266,ja also will rennen und und hochsprung
d1082_2-TLI_267,und
d1082_2-TLI_268,ja das weiss ich jetzt nicht mehr also balspiel haben wir gehabt
d1082_2-TLI_269,und
d1082_2-TLI_27,und wir als kind also wir haben uns
d1082_2-TLI_270,ja das ist dass ich bin eben nicht so ein sportliche mann sie ich
d1082_2-TLI_271,mag mich nicht mehr recht erinnern
d1082_2-TLI_273,man
d1082_2-TLI_274,ja das ist etwas wo
d1082_2-TLI_275,das sind zeltlager gewesen
d1082_2-TLI_277,im tschutten vor allem auch noch so eine politische manifestation gegeben mögen sie sich dass
d1082_2-TLI_28,mh ja ich das mag ich mich nicht mehr so genau erinnern
d1082_2-TLI_281,also das leicht schon vom osten erwartet haben was von dort kommt
d1082_2-TLI_282,und einfach unerschütterlich an das geglaubt haben wie die kommunisten also
d1082_2-TLI_283,und dass wir auch
d1082_2-TLI_284,ja wir haben gefunden es muss von dort kommen
d1082_2-TLI_287,also wir haben vor also
d1082_2-TLI_288,kindern müssen vor allem zur allgemeine solidarität erzogen werden
d1082_2-TLI_289,und politische bildung haben wir gehabt
d1082_2-TLI_29,ich bin dann in die erste schulklasse gegangen ich weiss nur noch
d1082_2-TLI_290,dass es natürlich schon immer arme gegeben hat und
d1082_2-TLI_291,und das was man uns in der schule da dort lehrt und was man da hören
d1082_2-TLI_292,das ist sehr einseitig
d1082_2-TLI_293,es hat immer ein oberschicht gegeben
d1082_2-TLI_294,und es hat einfach sozusagen in jeder zeit
d1082_2-TLI_295,hat das menschen gegeben wo
d1082_2-TLI_296,auch in der schweiz einen halben wie in den arbeitsklaverei
d1082_2-TLI_297,haben müssen leben
d1082_2-TLI_298,und dass man das einfach wollen
d1082_2-TLI_299,das unbedingt muss verbessert werden und vor allem dass man
d1082_2-TLI_3,dass er wieder hat können sich irgendwie
d1082_2-TLI_30,dass man mich fortgeschickt hat
d1082_2-TLI_300,das wichtigste ist für uns der arbeitende mensch gewesen
d1082_2-TLI_301,jeder mensch wo etwas schafft verdient hochachtung
d1082_2-TLI_302,und die menschen müssen müssen gewehrt werden und
d1082_2-TLI_303,und man muss dankbar sie für die wo wo wo schaffen
d1082_2-TLI_304,und wenn das die allerniedrigst arbeiten sind
d1082_2-TLI_305,das ist ganz gleich wenn das wehenszehensputzen ist
d1082_2-TLI_306,und das ist ebenso wichtig
d1082_2-TLI_307,und er duellentenfrau ist ebenso viel wert
d1082_2-TLI_308,wie der babst so gut das ist jetzt klein krass aber
d1082_2-TLI_309,so in dem stil ist das gegangen
d1082_2-TLI_31,bei mir haben so eine landenberganlage hat das geheissen
d1082_2-TLI_311,haben sie denn auch lesungen
d1082_2-TLI_312,gemacht oder
d1082_2-TLI_313,oder miteinander das kapital
d1082_2-TLI_316,also so etwas ist ein klein später kommen
d1082_2-TLI_317,aber ich bin gar ich habe das gar nie recht verstanden
d1082_2-TLI_318,da hat man so von mehrwart geredet das ist aber in der sozialisten jugend denn eher kommen
d1082_2-TLI_319,also wir haben von den russischen geschichte natürlich gehört
d1082_2-TLI_32,und ich soll dort in die anlage und es ist
d1082_2-TLI_320,von der revolution neunzehnhundertsiebzehn
d1082_2-TLI_321,und das der lenin in der schweiz gewesen ist
d1082_2-TLI_322,und wo er gewohnt hat und
d1082_2-TLI_323,und und ja so ungefähr in dem stil
d1082_2-TLI_324,und dann haben wir noch etwas gewusst von einem haus
d1082_2-TLI_325,das ist das kaffee bei gewesen das haus
d1082_2-TLI_326,wo von ja also
d1082_2-TLI_327,auch von sozialdemokraten und kommunisten
d1082_2-TLI_328,ist das geld gesammelt worden dass man das haus haben können bauen
d1082_2-TLI_33,im januar gewesen und ich bin dann gegangen
d1082_2-TLI_331,und das dort hat es eine jugendstube gehabt
d1082_2-TLI_332,mag mich zwar nicht erinnern dass man jemals
d1082_2-TLI_333,dort gewesen sind in den roten falken
d1082_2-TLI_334,aber es wäre so geplant gewesen
d1082_2-TLI_335,dass die jugendlichen dort ihren treffpunkt haben
d1082_2-TLI_336,und es hat also es hat in den kreisen natürlich auch freidenker gehabt
d1082_2-TLI_337,also obwohl nicht gerade etwas negatives gegen
d1082_2-TLI_338,kirchliche amassungen gehört haben das will ich jetzt nicht sagen
d1082_2-TLI_339,aber es ist es ist teilweise
d1082_2-TLI_34,und wo ich wieder heimgekommen bin ist er tot gewesen
d1082_2-TLI_340,die kinder es ist ein klein ein sammelbecke gewesen von verschiedenen linken
d1082_2-TLI_341,es hat zwar später
d1082_2-TLI_342,oder gleichzeitig auch die junge pioniere gegeben
d1082_2-TLI_343,aber das dort könnte ich jetzt fast nichts darüber sagen
d1082_2-TLI_344,das sind denn die extrem kommunistischen kinder gewesen
d1082_2-TLI_345,aber ich wüsste nichts darüber es hat auch ein sozialistische sonntagsschule gegeben
d1082_2-TLI_346,das habe ich aber von einer bekannten gehört
d1082_2-TLI_347,sie selber sind nie
d1082_2-TLI_349,ja die sozialistischen sonntagsschule das ist so in den ja da bin ich schon zu alt gewesen genau
d1082_2-TLI_35,und das ist für mich eine unvorstellbaren schock gewesen
d1082_2-TLI_350,das hat das also auch gegeben
d1082_2-TLI_352,mögen sie sich noch eine einzelne von denen
d1082_2-TLI_353,lieder erinnern wo sie gesungen haben
d1082_2-TLI_355,echsgeäuse wenn ein aufstehe
d1082_2-TLI_357,mir mädchen und wir buben wollen schaffen und nicht ruhen
d1082_2-TLI_358,bis die menschheit endlich frieden finde und alle kindern glücklich sind
d1082_2-TLI_36,ja er ja und
d1082_2-TLI_360,vom arbohner falkenhelfer
d1082_2-TLI_361,ja wo auch in dem steil auch in dem stil gewesen ist
d1082_2-TLI_362,das ist das lied gewesen
d1082_2-TLI_363,also einfach für einen andere
d1082_2-TLI_364,einen andere gesellschaftsordnung eine andere welt aber etwas wo wir
d1082_2-TLI_365,wo man eigentlich verstanden hat
d1082_2-TLI_366,und dann haben wir gehabt also zum beispiel natürlich
d1082_2-TLI_367,bruder zur so ein zur freiheit
d1082_2-TLI_368,und die töchter haben dann können singen schwestern zur so ein zur freiheit
d1082_2-TLI_369,und wenn wir schreiten sagt an sagt und die alten lieder singen
d1082_2-TLI_37,dann ist er noch zwei tage tot daheim gewesen
d1082_2-TLI_370,und teilweise sind es lieder gewesen von der wandervogelbewegung wo man übernommen hat
d1082_2-TLI_371,und vor allem die lieder mit uns zeit ein neuer geist
d1082_2-TLI_372,mit uns zeit die neue zeit
d1082_2-TLI_373,und man hat wirklich an das geglaubt also
d1082_2-TLI_374,es ist eine eine totales feuer gewesen
d1082_2-TLI_375,wo man wirklich ganz sicher gewesen sind
d1082_2-TLI_376,jetzt geht es in eine andere richtung
d1082_2-TLI_377,sind sie über die damaligen
d1082_2-TLI_378,politischer entwicklungen zu deutschland informiert gewesen
d1082_2-TLI_38,wie es so früher gewesen ist
d1082_2-TLI_380,informiert gewesen über den russland feldzug
d1082_2-TLI_381,aber sonst also eben ja
d1082_2-TLI_382,aber sonst eigentlich nicht
d1082_2-TLI_384,da sind sie noch klein jünger gewesen
d1082_2-TLI_385,ja also ich weiss dass
d1082_2-TLI_386,also das ich in unserer familie
d1082_2-TLI_387,also ich weiss von meinem
d1082_2-TLI_388,ich weiss nur von meinem unkel vom jacke streulein
d1082_2-TLI_389,dass er im kabarett cornichõõ
d1082_2-TLI_39,und ich mag ich mag mich erinnern
d1082_2-TLI_390,kabaretteste gewesen ist und allmal auch so
d1082_2-TLI_391,kurze passage geschrieben hat
d1082_2-TLI_392,und dass er natürlich auch keine stelle mehr gefunden hat und dann hat müssen
d1082_2-TLI_393,als platzanweiser irgendwo schaffen im weiss aber nicht mehr recht wo
d1082_2-TLI_394,und er ist dann selten zu uns heimgekommen
d1082_2-TLI_396,er hat uns aber einmal einen radio geschenkt
d1082_2-TLI_397,wo noch fast niemand ein radio gehabt hat
d1082_2-TLI_398,und das ist eigentlich meinem vater sein heiligtum denn gewesen
d1082_2-TLI_399,in seiner krankheitszeit der radio
d1082_2-TLI_4,wieder aufgetanken aber er ist also pseuchist dann auch
d1082_2-TLI_40,dass wir das sehr lange ist mir das nachgegangen
d1082_2-TLI_400,er ist dann ganz informiert gewesen immer
d1082_2-TLI_401,hat aber wenig geredet über dass wir haben das auch wahrscheinlich auch nicht verstanden
d1082_2-TLI_402,und mein bruder hat
d1082_2-TLI_403,also eienlich schon sehr früh radio gelost
d1082_2-TLI_404,schon als sieben- achh neunjährigen
d1082_2-TLI_405,haben wir hat er radio gelost und ist
d1082_2-TLI_406,und ich ich eigentlich nicht
d1082_2-TLI_407,sind sie das cabarett cornichõõ einmal gan besuchen
d1082_2-TLI_408,nein wir hätten das auch ich mag mich erinnern
d1082_2-TLI_409,dass wir einmal mit unserer grossmutter
d1082_2-TLI_41,und ich weiss nur noch dass ich
d1082_2-TLI_410,haben können in den ersten
d1082_2-TLI_411,und das ist ja dort gewesen
d1082_2-TLI_412,aber ich bin nicht mehr ganz sicher was gewesen ist
d1082_2-TLI_413,soweit ich mich erinnern ist es eher etwas
d1082_2-TLI_414,einfacheres gewesen wo wir auch so halben
d1082_2-TLI_415,man hat ja das nicht verstanden
d1082_2-TLI_416,also sonst hätten wir ja das gar nicht verstanden
d1082_2-TLI_417,aber sie ist dann viel in das cabarett cornichõõ gegangen
d1082_2-TLI_418,und sie hat auch zeitungen gelesen
d1082_2-TLI_419,aber das ist einfach für uns irgendwie noch
d1082_2-TLI_42,in der eine gute schülerin gewesen bin und von dort an
d1082_2-TLI_420,noch zu früh gewesen
d1082_2-TLI_421,und
d1082_2-TLI_422,ja also über den über
d1082_2-TLI_423,was sie vorher gefragt haben über den zweite weltkrieg
d1082_2-TLI_424,also eigentlich haben wir nicht sehr viel mitübergekommen
d1082_2-TLI_425,das heisst wir haben insofern etwas mitübergekommen
d1082_2-TLI_426,das ist man jetzt wieder in den sinn gekommen wo ich mit meiner bekannten geredet habe
d1082_2-TLI_427,und zwar ist das gewesen man hat ein so eine plakate angehabt
d1082_2-TLI_428,mit namen und datum darauf
d1082_2-TLI_429,dass wenn wir müsste flüchten
d1082_2-TLI_43,eigentlich habe ich gar nicht mehr gut können rechnen
d1082_2-TLI_430,in die innerschweiz dass man dann oder ja oder wenn plötzlich
d1082_2-TLI_431,dass man noch wüsste wäre das gewesen ist wo jetzt dann gestorben ist
d1082_2-TLI_432,und die hat man dann
d1082_2-TLI_433,daheim neisswo aufbewart dass man die sofort muss anlegen
d1082_2-TLI_434,das ist der sogenannte grabstein gewesen
d1082_2-TLI_436,und also meine freundin die fabe ich ein klein
d1082_2-TLI_437,die hat das noch aufbewart die grabstein und ich habe er gesagt richter das ja nicht fort ich
d1082_2-TLI_438,ich ich t ja sie hat das noch aufbewart von
d1082_2-TLI_44,und bei ja
d1082_2-TLI_440,das ist wenn bombardiert worden wäre
d1082_2-TLI_441,oder wenn wir in die innerschweiz hat müssen flüchten aber
d1082_2-TLI_442,ja das ist ein und einen rücksack
d1082_2-TLI_443,ja es haben alle einen rücksack parat gehabt
d1082_2-TLI_444,wenn man musst flüchten oder in den wald
d1082_2-TLI_445,also das ist man noch so halben bekannt
d1082_2-TLI_446,und dann weiss ich noch aus der zeit
d1082_2-TLI_447,vom möslein also selber habe ich das aber nicht mitübergekommen
d1082_2-TLI_448,das ist aus aus erzählungen
d1082_2-TLI_449,in dem haus
d1082_2-TLI_45,also mein mein bruder ist in den kindergarten gegangen und
d1082_2-TLI_450,sind emigranten und flüchtlinge versteckt worden
d1082_2-TLI_451,und die haben können bei der in der umgebung
d1082_2-TLI_452,bei bauern gan schaffen die bauern sind froh gewesen weil
d1082_2-TLI_453,sehr viele männer haben ja müssen in dienst
d1082_2-TLI_454,und dann haben sie dort können versteckt überleben
d1082_2-TLI_455,und sind nie verraten worden
d1082_2-TLI_456,sie selber haben
d1082_2-TLI_458,also ja
d1082_2-TLI_459,jetzt vielleicht noch zu einem ereignisse
d1082_2-TLI_46,in welchem jahr ist er genau gestorben
d1082_2-TLI_460,ende dreissigerjahren wo mal vordergründung nicht so
d1082_2-TLI_461,politisch aufgetreten ist
d1082_2-TLI_462,die landesausstellung neunzehnneununddreissig
d1082_2-TLI_464,ja man sind gewesen aber ich habe keine erinnerungen
d1082_2-TLI_465,und so es ist natürlich das gewesen
d1082_2-TLI_466,also ich mag mich nur erinnern
d1082_2-TLI_467,dass meine mutter allmal also
d1082_2-TLI_468,sie ist schon auch einmal mitkommen mit uns aber
d1082_2-TLI_469,sie hat ich weiss nur dass sie viel gesagt hat das ist alles nicht für uns
d1082_2-TLI_47,neunzehnhundertsiebenunddreissig
d1082_2-TLI_470,ja wir sind so arm gewesen
d1082_2-TLI_471,also das ist einfach etwas gewesen wo
d1082_2-TLI_473,das ist einfach nicht für uns
d1082_2-TLI_474,in gleichen jahren hat ja dann
d1082_2-TLI_475,generalmobilmachung
d1082_2-TLI_477,nein an das habe ich keine erinnerungen
d1082_2-TLI_479,wie hat sich dann der
d1082_2-TLI_48,wie hat sich nachher können die familie über wasser halten
d1082_2-TLI_480,krieg ausgewirkt auf der alltag von der familie
d1082_2-TLI_481,hat sich da etwas verändert von den harten
d1082_2-TLI_483,sozusagen nichts verändert
d1082_2-TLI_484,weil wir sind immer meine sind immer so arm gewesen
d1082_2-TLI_485,also es ist einfach so
d1082_2-TLI_486,ja also was man
d1082_2-TLI_487,gegessen haben
d1082_2-TLI_488,man haben einfach es hat einfach röschte gegeben und suppe und brot und
d1082_2-TLI_489,gehungert haben wir natürlich nie
d1082_2-TLI_49,also meine mutter
d1082_2-TLI_490,sagen eben nicht aber
d1082_2-TLI_493,also wir haben einen schrebergarten gehabt
d1082_2-TLI_494,bis mein vater gestorben ist
d1082_2-TLI_495,und meine mutter hat dann das nicht mehr können halten
d1082_2-TLI_496,der schriebergarten weil sie sonst so viel arbeit gehabt hat
d1082_2-TLI_497,wo ist der gewesen
d1082_2-TLI_498,und der schrebergarten
d1082_2-TLI_499,das ist für uns sehr schmerzlich gewesen
d1082_2-TLI_5,so wie eine depression inhingekommen
d1082_2-TLI_50,hat dann
d1082_2-TLI_500,dass wir den schrebergarten nicht mehr gehabt haben
d1082_2-TLI_501,es ist man hat einen uns einfach weggenommen also
d1082_2-TLI_502,das ist an der wasserwerkstrasse gewesen sind die schrebergarten gewesen
d1082_2-TLI_503,und mein vater ist sehr an denen garten gehangen an dem garten gehangen
d1082_2-TLI_504,also meine gotte hat dann noch einen garten gehabt
d1082_2-TLI_505,in hank und
d1082_2-TLI_506,wir haben dann eigentlich noch viel übergekommen von dort auch während dem krieg
d1082_2-TLI_507,wir haben ja also
d1082_2-TLI_508,und ja aber sonst
d1082_2-TLI_509,mögen sie sich
d1082_2-TLI_51,müssen putzen und waschen
d1082_2-TLI_510,in dem zusammenhang auch an die rationierung erinnern
d1082_2-TLI_511,ja
d1082_2-TLI_512,also ich mag mich erinnern eben an die märklein
d1082_2-TLI_513,und wir haben immer genug marken gehabt
d1082_2-TLI_514,also für unsere bedürfnisse
d1082_2-TLI_515,ich weiss nume dass es natürlich sehr wenig butter gegeben hat
d1082_2-TLI_516,und keine schoggi
d1082_2-TLI_517,und wir allmal so einen einen
d1082_2-TLI_518,ein schlagrahm gemacht hat
d1082_2-TLI_519,aus irgendwelcher
d1082_2-TLI_52,und dann sind
d1082_2-TLI_520,pulver und so eine und milch und dann irgend noch
d1082_2-TLI_521,sonst etwas dass man gemeint hat man habe schlagrahm ja
d1082_2-TLI_522,haben sie verwandte gehabt auf dem land wo sie da noch unterstützt hätten
d1082_2-TLI_523,ja also mein
d1082_2-TLI_524,mein halbbruder ist ja dann eben nach bonningen
d1082_2-TLI_525,in das blindenheim gan schaffen
d1082_2-TLI_526,und hat eine tochter geheiratet wo ein bauernhof gehabt haben
d1082_2-TLI_527,und von dort haben wir mitunter einmal
d1082_2-TLI_528,etwas übergekommen aber auch selten
d1082_2-TLI_529,aber ich mag mich nicht mehr erinnern
d1082_2-TLI_53,leute gekommen vom sozialamt
d1082_2-TLI_530,ich weiss nur dass man noch es hat eipulver gegeben
d1082_2-TLI_531,und
