Filename,Transcript
d1209-T846,muss ich jetzt vielleicht noch ein beispiel verzollen wie es gegangen ist mit der mit der beamten von bern
d1209-T847,in dem gebiet ist gewesen wo sehr militär ist gewesen hat es auch dem entsprechend lanschaden gegeben
d1209-T848,und die bauern haben können der landschaden können anmelden
d1209-T849,und ist ein
d1209-T85,bundesarchive gezügelt worden
d1209-T850,einer kommen von bern wo das ist gan begutachten ob das angemessen ist oder nicht
d1209-T851,und der hat sich dann bei der gemeinde gemeldet
d1209-T852,wenn er es wenn er oder sogar zu zw zu zweite kommen haben sich dann bei der gemeinde gemeldet und haben dann mit meinem vater müssen der vater hat die ganze gemeinde gekannt
d1209-T853,bis in allen alpen aufhin
d1209-T854,hat er der mit denen müssen gan der landschaden gan begutachten oder wenigstens den weg zeigen
d1209-T855,wo das ist
d1209-T856,und das sind mängist
d1209-T857,zwei drei stunden müssen laufen man hat eine der vater hat nicht können autofahren und einen jeep ist nicht zur verfügung gestanden dann ist man halt gelaufen
d1209-T859,und dann ist er auch bei einem so einen bauer vorbeigekommen und hat gesagt
d1209-T86,ist das wichtig gewesen so für sie
d1209-T860,machst dann für uns etwas zmittag wir kämen dann da müssen noch dort und dort vorbei und kommen etwa in zwei stunden oder innert stunden wieder zurück
d1209-T861,dann ist halt das dummerweise an einem freitag gewesen und dann beamten und dann natürlich nicht da
d1209-T862,gross dem beachtung geschenkt fleischlos oder nicht fleischlos wir haben ja zwei tage in der wochen flassen keine flein fenschlos gewesen
d1209-T863,dann hätten die die berner herren sollen an den tisch herrensitzen in den bauern in der bauernwirtschaft oder in der bauerngaststuben und hätten sollen fleisch essen und die sind natürlich ganz schockiert gewesen dass man da am freitag fleisch auf den tisch überkommt
d1209-T864,der vater hat doch denen gesagt losen das passiert doch nicht da müssen nicht angst haben und die haben den wacker zugepackt und mit der zeit sie sie nume noch a denen tagen gewesen wo sie keine fleischlos hat sollen sie wo sie genau gewusst haben dass man da an einem tisch kann zuhinsitzen und wo es fleisch gibt
d1209-T867,gut
d1209-T868,dann
d1209-T869,danke ich ihnen herzlich für sie gespräche also ich habe es jetzt sehr spannend gefunden
d1209-T87,das ist sehr
d1209-T870,bitte ist gern geschehen
d1209-T871,jetzt müssten wir noch schnell zwei kleine sachen machen einerseits müsst ich noch ganz schnell
d1209-T872,einen stummes bild also dass sie mich schnell
d1209-T873,zehn zwanzig sekunden anlugen und er einfach kamera laufen lässt
d1209-T874,mh
d1209-T875,das ist einfach da
d1209-T876,direkt gerade direkt
d1209-T88,sind doch so vor
d1209-T881,das ist ein
d1209-T882,kilofünfhundert gramm zucker siebenhundertfünfzig gramm teigwaren zweihundertfünfzig gramm reis
d1209-T883,zweihundertfünfzig gramm hülsenfrüchte
d1209-T884,siebenhundertfünfzig gramm hafer oder gerstenprodukt
d1209-T885,und da ist eine karten aus dem
d1209-T886,noch merze neunzehnhundertachtundvierzig
d1209-T887,also achtundvierzig
d1209-T888,mit brot teigwaren butter milch
d1209-T889,das sind sie dann klein grosszügiger gewesen dann hat es hundert punkt käse gehabt
d1209-T89,von der alten eidgenossenschaft her hat doch der kanton hat doch die urschweiz sich noch etwas eingebildet und das ist doch ein ereignis gewesen
d1209-T890,paar liter milch
d1209-T892,oder eine
d1209-T893,eine halbe brotkarte speziellbezug gewesen nume für brot
d1209-T894,ein schulkarten
d1209-T895,noch eine ganze
d1209-T896,oder eine textilkarten
d1209-T897,ist wahrscheinlich auch sehr kompliziert gewesen oder
d1209-T898,so mit all denen verschiedenen
d1209-T899,mit denen verschiedenen coupon ja vor allem die dinge die wo haben müssen damit abrechnen nachher
d1209-T9,das ganze gemeindeverwaltung unterbracht gewesen
d1209-T90,dann ist natürlich mit dem bundesbriefarchive ist mit militär und mit musik und mit regierungsvertretung und alles ist das gezügelt worden
d1209-T900,die haben ja das müssen wieder ein
d1209-T901,ich bogen aufkleben
d1209-T902,da ist es nume fleisch gewesen hundert punkt fleisch
d1209-T903,zweihundertfünfzig punkt fleisch fünfhundert punkt fleisch aber was ein punkt ist gewesen das ist wahrscheinlich gramm entsprochen oder dem
d1209-T904,kilopreise das kann ich dann nicht mehr genau sagen
d1209-T905,die die teilweise in den läden sie sind sehr streng gewesen
d1209-T906,wo natürlich nicht ausgegeben haben ohne die coupon
d1209-T907,andere sind wieder legerer gewesen
d1209-T909,eben dank dem dass wir ein grosshaushalt gewesen sind
d1209-T91,obwohl man vorher vielleicht mit der
d1209-T910,haben wir noch vermehrt andere coupon gehabt wir sind eigentlich nicht die gewesen wo not gelitten haben
d1209-T911,mal schnell zu mir lugen und gut
d1209-T912,die coupon filme
d1209-T913,ja
d1209-T914,vielleicht nicht gerade alle aber vielleicht so es paar als beispiel aber vielleicht
d1209-T915,ich weiss nicht ob man das plakate nochmal könnte auch
d1209-T916,nein kann man es schon
d1209-T917,das ist jetzt das plakate wo
d1209-T918,der herr b*** augehenkt hat bei der mobilisation
d1209-T919,können sein ja das ein
d1209-T92,freinken wo da am bundesarchive ist doch sehr modern nicht ganz einverstanden ist gewesen
d1209-T923,aber vielleicht wollen sie zu erst einmal auf den tisch
d1209-T926,he eben wo dann der von bef
d1209-T927,der befehl gekommen ist von bern da die kriegsmobilmachung
d1209-T928,ausgerufen ist worden hat man müssen die plakate auf machen in der ganzen gemeinde verschiedenen schulhäuser an plakatusherngestellen und
d1209-T929,ist das nachher dann aufgehängt worden und dann bin ich mit dem vater dabeigewesen wo dann
d1209-T93,und ich weiss es ist einmal einen anschlag gegen das gewesen von der studenten wahrscheinlich vom kollegin
d1209-T930,die plakate ist gan anhinmachen im ganzen dorf und in der umlegender gemeinden
d1209-T931,und wieso haben sie jetzt das noch
d1209-T934,oder der vater hat es abgenommen das weiss ich nicht mehr auf alle fälle ist es jetzt in meinem besitz
d1209-T935,und ist sicher noch einer von der wenigen orriginalplakate von damals
d1209-T937,ich weiss es im bundesarchive unten sind auch noch ist sind auch noch deponiert
d1209-T938,aber privatbesitz ist das wahrscheinlich seinzungen
d1209-T939,hat es dann ihr vater so wichtig gefunden dass er das jetzt noch aufbehalten hat
d1209-T94,dass man das irgendwie
d1209-T940,wahrscheinlich schon ja
d1209-T941,interessant
d1209-T942,merci
d1209-T943,bitte die karten sind dann noch länger gegangen he
d1209-T947,nehmen glaube einfach ein paar beispiel so dass wir
d1209-T95,hat wollen verunn ver
d1209-T96,ja man hat das einfach nicht wollen dulden dass das auf die moderne art gegangen ist da ist es dann maler danjot gewesen von
d1209-T964,muss natürlich auch gesehen dass die von roll
d1209-T965,ist das
d1209-T968,und dann sind dann derigen wo
d1209-T969,katholischkonservaten entschuldigung
d1209-T97,vom urnerland wo die fresken gemacht hat
d1209-T972,im kann zu solothurn sowieso das ist sowieso so
d1209-T974,ein ding gewesen wo in der
d1209-T978,und mit dem dreispitzhut der gemeinderat von schweiz begleitet hat
d1209-T979,die haben im vierteljahren einmal gratis können dort gan übernachten und haben zu nachtessen morgen essen übergekommen und wir sind das so klein
d1209-T98,und nachher hat man das irgendeinest ein anschlag gemacht ich weiss nicht mehr genau was auf alle fälle ist ein plakate über das ganze gehangen wo das irgendwie
d1209-T980,und die nächste ist in altdorf gewesen
d1209-T99,ein klein nicht gerade gerühmt hat und am anderen tag hat der danew yot wieder selber einen anschlag gemacht darauf und hat geheissen das ist nämlich noch geblieben
