Filename,Transcript
d1225-TLI_830,und darum habe ich dann dann urlaub übergekommen und habe können meine sachen wieder machen und meine prüfungen machen
d1225-TLI_831,aber man hat sich das schampaar müssen wehren
d1225-TLI_832,das hat schon klein an der nerven gezogen aber
d1225-TLI_833,und dann ist natürlich die zeit gekommen dass man sechs wochen im dienst gewesen ist sechs wochen daheim sechs wochen im dienst
d1225-TLI_834,das können sie sich denken wie man das kann studieren in der sache
d1225-TLI_835,und es also genugend erschwerungen dann
d1225-TLI_836,zusätzlich noch gegeben habe
d1225-TLI_837,hat sie dann da von uni kein entgegenkommen gegeben also dass man irgendwie im wintersemester prüfungen
d1225-TLI_839,eher aber das hat man nicht dann können im winter machen das hat man einfach stur
d1225-TLI_84,aber ich bin ja am seminar kisnacht gewesen und dort hat es ja dann schwierigkeiten gegeben
d1225-TLI_841,ich bin ja nur im militär vorstellung geworden
d1225-TLI_842,also das ist ein klein eine heiklein nerversage gewesen dort und es ist also
d1225-TLI_843,ich habe es doch können durchsetzen aber wie gesagt
d1225-TLI_844,wie haben sie dann das wahrgenommen wenn sie dann wieder ins zivilleben kommen sind also was ist denn das anders gewesen als im militär
d1225-TLI_846,zu dem wo sie aus der armee gekannt haben
d1225-TLI_847,ja also in der armee haben wir eine sehr gute verpflegung gehabt man haben auch fast keine kranken gehabt
d1225-TLI_848,fast nie nur einmal hat es schwierigkeiten gegeben
d1225-TLI_849,ich bin ja in der division bircher gewesen
d1225-TLI_85,mit direktor das mit dem deutschlehrer korrode mit dem
d1225-TLI_850,wir haben den tag durch schwer geschafft voraussen da habe
d1225-TLI_851,körperliche arbeit und dann hat das birchermüsliznacht gegeben
d1225-TLI_852,und das hat natürlich überhaupt nicht herhingehalten habe
d1225-TLI_853,das ist keine verpflegung gewesen
d1225-TLI_854,wo ausreichend gewesen wäre habe
d1225-TLI_855,und dann hat es natürlich mais gegeben und haben gesagt mich wollen das nicht mehr
d1225-TLI_856,und dann haben sie aber sofort nachgegeben und es hat keine birchermüslein mehr gegeben sondern hat ein verschafte kost gegeben
d1225-TLI_857,und da hat man sich einfach müssen wehren aber das ist irgendwie
d1225-TLI_859,trotzdem ich also zum herr bircher überhaupt null beziehungen gehabt habe
d1225-TLI_86,deutschlehrer ritmeier wo man gesagt hat aha
d1225-TLI_860,und nachher wenn sie dann zurückgekommen sind ins zivilleben hat es dann weniger zu essen gegeben und haben sie hunger gehabt in der zeit
d1225-TLI_861,nein ja man hat müssen halt ein klein
d1225-TLI_862,auf sachen verzichten oder so aber
d1225-TLI_863,ich habe voll müssen schaffen dass ich meine sachen habe können herhinbringen
d1225-TLI_864,und also das mich dann
d1225-TLI_865,gelitten hätten aus irgenehmen mangel das
d1225-TLI_866,weniger süssigkeiten gegeben hat oder so
d1225-TLI_867,also das ist das ist rationiert gewesen und man hat müssen einteilen und
d1225-TLI_868,das ist mit einer gewissen selbstverständlichkeit hingenommen worden
d1225-TLI_869,ohne mauerren ohne mauern eines hat vielleicht leute gehabt wo beschissen haben
d1225-TLI_87,die halten eher am ende noch auf die deutschen seite aber in der klassen selber
d1225-TLI_870,wir sind einmal wir haben einmal
d1225-TLI_871,sind einmal abkommandiert worden unsere kompanie nach steiner schweiz
d1225-TLI_873,weil das eben nicht sich an die rationierung gehalten haben
d1225-TLI_874,und wie sind dann dort vier wochen gewesen klein spiessruten gelaufen
d1225-TLI_875,sie haben ja müssen es militär zahlen
d1225-TLI_876,dort die die von steiner
d1225-TLI_877,und aber
d1225-TLI_878,wir haben dort keine konflickt gehabt mit der bevölkerung
d1225-TLI_879,mein erlebnis ist dort nur gewesen ein klein ich habe das in der wirtschaften gesehen
d1225-TLI_88,haben wir eigentlich von dem nichts gespürt
d1225-TLI_880,wie das zum teilweise von junger menschen ziemlich viel schnaps getrunken wird
d1225-TLI_881,also ist man auch in erinnerung geblieben
d1225-TLI_884,wegen der bevölkerung wo man gewesen ist
d1225-TLI_885,das ist so gewesen im im kanton aargau ist man natürlich da
d1225-TLI_886,sehr mit der bevölkerung in kontakt gekommen und die aargauischen bevölkerung ist sehr militärfreundlich gewesen
d1225-TLI_887,und wir haben ja alles unteroffiziere nicht das recht gehabt in zimmer sogar zu schlafen
d1225-TLI_888,und es ist natürlich äusserst einfach gewesen
d1225-TLI_889,am morgen ist alles wasser in der wechseln gefroren gewesen
d1225-TLI_89,nur der korodi der ist autor gewesen
d1225-TLI_890,und also es ist eingeschalt gewesen
d1225-TLI_891,und wie sind bei einfachen bauersleuten unter sind wir gewesen
d1225-TLI_892,zu abend sind wir mit denen zusammengesessen haben mit denen geredet
d1225-TLI_893,man hat gehört aha das sind bauern wo vom emmental da herhin gekommen sind
d1225-TLI_894,und jetzt das ihre existenz im kanton aargau aufbauen
d1225-TLI_895,man hat interessante sachen mit der bevölkerung kontakt übergekommen
d1225-TLI_896,das ist es hat mich sehr positiv gedünkt
d1225-TLI_897,und dann auch in der innerschweiz natürlich erst recht
d1225-TLI_898,das haben wir ein klein die gegensetz kennengelernt wenn man die einfachen
d1225-TLI_899,klapptachhäuser im talchessolle schweiz sieht
d1225-TLI_9,und eigentlich seit frühesten jahren
d1225-TLI_90,vom von der scheckbiografie
d1225-TLI_900,und wenn man in die häuser inhinkommt
d1225-TLI_901,wie das sehr gut eingerichtet sind
d1225-TLI_902,mit einbaubad damals und alles zusammen
d1225-TLI_903,es ist einem dann aufgefallen und wenn man dann einem mutetal hinten gewesen ist beisistal
d1225-TLI_904,einbergereck und anders und dann dort inhingekommen ist in die
d1225-TLI_905,in die bauernstube hat es dann noch ganz anders ausgesehen
d1225-TLI_906,und ich habe da noch ein bild von unseren leuten da
d1225-TLI_907,wo man doch in so einer bauernstube innen sind da ist das zufällig habe ich das bild entdeckt
d1225-TLI_908,so ist dann das zugegangen wenn man so einer bauernstube innen gewesen ist sehen sie
d1225-TLI_909,mh was haben sie dann das gemacht da haben sie
d1225-TLI_91,und dann stück hat auch immer gesagt das kommt auf
d1225-TLI_912,man hat das auf dem auf dem boden geschlafen von denen bauernstube und so weiter
d1225-TLI_913,und die bauersleute sind also
d1225-TLI_914,sehr
d1225-TLI_915,haben grösstes verständnis gezeigt nur in einem nicht
d1225-TLI_916,und dort haben wir einmal also schwierigkeiten übergekommen und da sind wir geschuldet gewesen
d1225-TLI_917,nicht wahr die haben einfach für ihr gras und ihr he müssen lugen
d1225-TLI_918,und wenn das leute dann wo es
d1225-TLI_919,gras blüht hat und alles
d1225-TLI_92,das kommt in der schweiz einfach und da kommt ein deutschland nicht auf wird nicht anerkannt
d1225-TLI_920,vor dem meer gewesen ist und dann da soldaten da darüberinnen gelaufen sind
d1225-TLI_921,und dadurch gelaufen sind sind sie mit den sensen gekommen
d1225-TLI_922,und sind dann uns nachgerannt natürlich zu recht
d1225-TLI_923,und dann hat man allmal mit denen leute ja wieder geredet
d1225-TLI_924,und hat gesagt losen es ist uns so etwas ungeschickt es passiert
d1225-TLI_925,man hat das müssen zurückbuchstabieren
d1225-TLI_926,und dann ist der frieden wieder da gewesen
d1225-TLI_927,aber man hat die bevölkerung die bergbauern
d1225-TLI_928,eigentlich richtig kennengelernt
d1225-TLI_929,und denen ihr leben denen ihr ganz einfachen leben
d1225-TLI_93,weil halt einfach
d1225-TLI_930,kennengelernt das hat mich sehr beeindruckt habe
d1225-TLI_931,und das ist auch ein erlebnis gewesen wo
d1225-TLI_932,wo halt einfach daringeblieben ist
d1225-TLI_934,so zusammengesetzt ist und wäre das alles zu der schweiz gehört
d1225-TLI_936,nein das sind sehr eindrückliche sachen gewesen
d1225-TLI_937,was haben sie dann in der zeit gemacht in der in der freizeit im militär also wenn sie ausgang gehabt haben
d1225-TLI_938,sind sie da in die wirtschaft gegangen oder hat man da
d1225-TLI_939,ist man zusammengesessen und hat gesungen oder was hat man das gemacht
d1225-TLI_94,die ganze musik eigentlich
d1225-TLI_940,ja wenn man keiten gehabt hat ist man heimgegangen wenn man urlaub gehabt hat
d1225-TLI_942,oder sonst ist man dann
d1225-TLI_943,an einem sonntag hat man natürlich im feld gottesdienst das ist dann seeletürk gewesen nicht wahr
d1225-TLI_944,und am nachmittag ist man dann frei gewesen
d1225-TLI_945,und dann ist man irgendwie hat man gejasset oder man ist
d1225-TLI_946,zusammen gewesen kollegial
d1225-TLI_947,zusammen gewesen und eigentlich man hat das nie so verplant so
d1225-TLI_948,man hat das bereit wenn man nicht hat dürfen heim
d1225-TLI_949,das ist gewesen
d1225-TLI_95,beherst wird er hat nicht gerade gesagt von den juden aber weil einfach
d1225-TLI_952,ich weiss nicht ob ich das so kann sagen
d1225-TLI_953,aber es geht ja nicht gerade aushin
d1225-TLI_954,wissen sie das ist natürlich eine heiklen punkt gewesen ich habe
d1225-TLI_955,eine sache ist mir in erinnerung geblieben
d1225-TLI_956,also ich meine ein klein e ein extremes beispiel habe
d1225-TLI_957,wo wir noch in der innerschweiz gewesen sind
d1225-TLI_958,und natürlich unsere soldaten sind die frauen kommen
d1225-TLI_959,und dann sind es halt eppetdie auf den heustock gegangen
d1225-TLI_96,das ganze musikwelt
d1225-TLI_962,und nachher habe ich nochmal gesehen in den oberenberg
d1225-TLI_963,wo dann eine bäuerin gekommen ist und laut ausgerufen hat und gesagt hat
d1225-TLI_964,dann dort der hat kinder gebettet da auf meinem heustock
d1225-TLI_965,das ist dann also
d1225-TLI_966,türlich übelste aufgefasst worden he
d1225-TLI_967,aber das ist halt noch das hat dazugehört losen sie das ist nicht anders möglich gewesen
d1225-TLI_968,das ist doch ganz klar gewesen aber die innerschweizer bevölkerung also in der beziehung
d1225-TLI_969,natürlich ist das ob das da
d1225-TLI_97,so in deutschland beherst wird
d1225-TLI_970,es hat sicher freundschaften gegeben
d1225-TLI_971,offiziere soldaten alles zwischen denen
d1225-TLI_972,mädchen wo es dort gehabt hat und
d1225-TLI_973,ob das da auch mal
d1225-TLI_974,geheiratet worden ist das weiss ich nicht
d1225-TLI_975,aber es hat deutlich beziehungen gegeben zwischen den geschlechter das ist ganz klar
d1225-TLI_977,ist denn das eigentlich dort ein tabutenement gewesen also wenn wir jetzt
d1225-TLI_98,dass der stück eigentlich nie
d1225-TLI_980,ja verstecken nicht meine frau ist natürlich auch zukünftige frau ist auch kommen
d1225-TLI_981,auf oberbözberg oder auf einbergen
d1225-TLI_982,untereiberg obereiberg und so weiter
d1225-TLI_983,aber
d1225-TLI_984,ich muss sagen es ist irgendwie gar nicht abstossend gewesen
d1225-TLI_985,und das jeder seine das
d1225-TLI_986,freundin gekommen ist und mit der freundin ausgegangen ist und so weiter
d1225-TLI_987,das hat aber nicht die allergringster kritik ausgelöst damals schon
d1225-TLI_989,also dort ist ja ihr bataillon unter anderem aufgeboten worden also
d1225-TLI_99,das weiss ich noch dass der korrodin das gesagt hat
d1225-TLI_994,gewehrt haben wie ist das gewesen für sie also das sind jetzt plötzlich gegen die eigenen leute müssten
d1225-TLI_995,eingesetzt werden
d1225-TLI_996,also mein wir haben einfach müssen gut
d1225-TLI_997,was heisst das für rauen und ordnung sorgen wie sind dann einfach dort gewesen
d1225-TLI_998,und wir haben exerziert rund um die sache umhin und was
d1225-TLI_999,und ich habe dort auch wieder dort so
