Filename,Transcript
d1082_3-TLI_0,wie
d1082_3-TLI_10,mir vedunkled nööd das gaat nööd
d1082_3-TLI_100,wo nie hät es isch aber nie zum zuug choo
d1082_3-TLI_102,aso ich ich cha s nöd säge wisoo
d1082_3-TLI_103,irgendwie aso isch eso schtat land
d1082_3-TLI_104,das isch öppis gsii woo
d1082_3-TLI_105,win e en enoormi tränig
d1082_3-TLI_106,hät daa schtatgfunde
d1082_3-TLI_107,me bruuched obwool es hät ja vil puure ghaa
d1082_3-TLI_108,dene di sogenante rukseklipuure
d1082_3-TLI_109,woo ja au händ müese i d schtat go schaffe
d1082_3-TLI_11,aso daa machemer jez nööd mit
d1082_3-TLI_110,das das aso das hät mer ez miin maa verzelt vo
d1082_3-TLI_111,vo de fabrike won er gschafft hät
d1082_3-TLI_112,hät hät s ja vil ghaa vom land
d1082_3-TLI_113,wo choo sind aso
d1082_3-TLI_114,und dänn und dänn igenwo sogaar wiit
d1082_3-TLI_115,gloffe sind also früener isch mer ja ebe no gloffe
d1082_3-TLI_116,bis s wider händ chöne nöimed uf e baan
d1082_3-TLI_117,so sind s am morgen am
d1082_3-TLI_118,föifi dehäim furt das s händ chönen i d fabrik
d1082_3-TLI_119,hät s ja vil ggää
d1082_3-TLI_12,und im das han i aber eersch schpööter ärfaare
d1082_3-TLI_120,z simmer ja daa esoo i dä
d1082_3-TLI_121,viirzgerjaar zwäite wältchrieg ändi
d1082_3-TLI_122,möged si sich no an achte mäi erinnere
d1082_3-TLI_124,am achte mäi das isch genau dää taag gsii
d1082_3-TLI_125,won ich efeng e paar taag i minere leer gsii bin
d1082_3-TLI_126,und am achte mäi daa hämmer dänn
d1082_3-TLI_127,ds waarehuus gschlosse ghaa
d1082_3-TLI_128,und es isch en riisenumzuug gsii a de baanhoofschtraass
d1082_3-TLI_129,und ich und de tschörtschil isch choo
d1082_3-TLI_13,bi zwaar nöd sicher öb i s nöd süsch scho im oor ghaa han
d1082_3-TLI_130,und da daa isch en
d1082_3-TLI_131,e folkloore gsii
d1082_3-TLI_132,aso mit ross und trachte sowiit ich mich erinnere
d1082_3-TLI_133,jaa das isch aso ales gsii
d1082_3-TLI_134,won ich won ich miich mag erinnere
d1082_3-TLI_135,jez git s e kolosaali wändi
d1082_3-TLI_136,und jez wird de blik soo wider nach amerikaa uusgrichtet
d1082_3-TLI_137,das isch so zimli ales won i mi mag erinnere
d1082_3-TLI_138,und jez umbedingt änglisch leere dasch ganz wichtig
d1082_3-TLI_139,und jaa so i dem schtiil isch das ggange
d1082_3-TLI_14,im ragaz-huus hät me dänn amel müse go d glüebiren uusschalte
d1082_3-TLI_140,händ si au änglisch gleert nach nach em chrieg
d1082_3-TLI_141,jaa ha sofort aagfangen änglisch leere
d1082_3-TLI_142,ich ha jaa i de dritte sekundaarschuel han i italiänisch gleert
d1082_3-TLI_143,und dänn han i aber ä gfunde i mus sofort änglisch leere
d1082_3-TLI_144,das ich die ängländer cha bediene wo daa chömed und die amerikaaner
d1082_3-TLI_145,und sind dänn die au choo
d1082_3-TLI_147,und händ würklich iigchauft und
d1082_3-TLI_148,daa won ich jaa und
d1082_3-TLI_149,händ dänn daa die sanggaller schtikereien iigchauft
d1082_3-TLI_15,d polizei
d1082_3-TLI_150,und und me händ
d1082_3-TLI_151,me hät gfunde die lüüt mues me pfläge die händ
d1082_3-TLI_152,jaa di das isch wichtig fürs gschäft
d1082_3-TLI_153,und es isch dänn au
d1082_3-TLI_154,seer wärt druufgläit woorde
d1082_3-TLI_155,aso uf
d1082_3-TLI_156,dass mer ine die schwiizerisch kultuur zäiged asoo
d1082_3-TLI_157,zum biischpiil au appezällischi kultuur
d1082_3-TLI_158,und und
d1082_3-TLI_159,jaa das isch gmacht woorde das me denen öppis büütet vo de folkloore
d1082_3-TLI_16,und dänn sind s ä gschtraaft woorde
d1082_3-TLI_160,aso jaa nöd seer aber
d1082_3-TLI_161,doch es isch esoo gsii also
d1082_3-TLI_162,es isch wichtig die händ gäld und und
d1082_3-TLI_163,isch wichtig das s wider chömed
d1082_3-TLI_165,nach em chrieg
d1082_3-TLI_166,wo wo händ sii gschaffet
d1082_3-TLI_167,woo händ sii die gmacht
d1082_3-TLI_168,im jelmooli
d1082_3-TLI_17,und dänn händ s dänn händ s es dänn emaal uufggää
d1082_3-TLI_170,en seer en schööne lade gsii
d1082_3-TLI_171,und ich bi deet seer glüklich gsii
d1082_3-TLI_172,dass ich überhaupt
d1082_3-TLI_173,deet ha chöne leere
d1082_3-TLI_174,und das isch seer gfrööget gsii eson e leer im jelmooli
d1082_3-TLI_176,und das cha me siich nöd voorschtele was das für en schööne lade gsii isch
d1082_3-TLI_177,mir händ holztisch ghaa
d1082_3-TLI_178,glaas und schpiegel
d1082_3-TLI_179,und schööni gschtell und e
d1082_3-TLI_18,und händ halt gliich gliich verdunklet oder sind
d1082_3-TLI_180,e dekorazioon
d1082_3-TLI_181,also ich han im partäär han ich moldewaaren ghaa
d1082_3-TLI_182,und schtikereie und schtoff
d1082_3-TLI_183,und das isch öppis gsii wo für miich
d1082_3-TLI_184,gsii isch aso totaal anderi wält
d1082_3-TLI_185,als i de schuel und ja gfunde ich han daa gaar nöd schträng
d1082_3-TLI_186,me händ gnueg pärsonaal ghaa
d1082_3-TLI_187,s isch seer druuf wärt gläit woorde wi mer d lüüt
d1082_3-TLI_188,bedient und de jelmooli isch bekant gsii
d1082_3-TLI_189,das mer daa en eerschtklassigi leer macht
d1082_3-TLI_19,händ äifach im tunkle gschafft bi cherzeliecht wiitergmacht oder esoo daa
d1082_3-TLI_190,me händ vil vil verchaufsschuelige ghaa
d1082_3-TLI_191,s isch ä seer druuf wärt gläit woorde
d1082_3-TLI_192,wie mer s sälber präsentiirt
d1082_3-TLI_193,mir händ allerdings d leertöchtere händ all eson e
d1082_3-TLI_194,schwarzi glänzigi schooss aaghaa
d1082_3-TLI_195,und die schwarz glänzig schooss äini hämmer gschänkt überchoo
d1082_3-TLI_196,und die ander hämmer dänn äini glaub müese d helfti zale
d1082_3-TLI_197,ja so i esoo
d1082_3-TLI_198,bi seer schtolz gsii und ich ha gfunde
d1082_3-TLI_199,mol ich bi da öpper
d1082_3-TLI_2,das isch me hät es
d1082_3-TLI_201,wie lang hät die leer tuuret?
d1082_3-TLI_202,zwäi jaar
d1082_3-TLI_203,und nachhär händ sii glaub ich
d1082_3-TLI_205,ich han dänn han i dänn no im sankt annahoof
d1082_3-TLI_206,han i no gschafft
d1082_3-TLI_207,ja
d1082_3-TLI_208,und de sankt anehoof isch no relatiiv fortschrittlich gsii
d1082_3-TLI_209,dänn isch mer im fau-ha-tee-äl iiträtte
d1082_3-TLI_21,und mi seged nüüt das das das schtimi äifach nööd und
d1082_3-TLI_210,dä verband
d1082_3-TLI_211,jaa und ich jaa ja aso ich han dänn ghüraatet nünzehundertnüünevierzg
d1082_3-TLI_212,und dänn han ich aso
d1082_3-TLI_213,im dezämber isch dänn das chind uf d wält choo won ich zwänzgehalb gsii bin
d1082_3-TLI_214,und aso dä maa
d1082_3-TLI_215,isch natüürli ä totaal überforderet gsii als äinezwänzgjäärige maa
d1082_3-TLI_216,jaa und ich me händ möse dehäim wone binere bi minere mueter inere
d1082_3-TLI_217,unvoorschtelbaare ängi
d1082_3-TLI_218,und miini mueter hät äigendlich
d1082_3-TLI_219,nöd verschtande das ich ez
d1082_3-TLI_22,mi mi wänd mi vedunkled under känen umschtände
d1082_3-TLI_220,also daa äigendlich überhaupt
d1082_3-TLI_221,escho eso inen
d1082_3-TLI_222,inechoo bin aber
d1082_3-TLI_223,ich han umbedingt das chind wele
d1082_3-TLI_224,und ich han äifach wele e geborgehäit und welen öppis für
d1082_3-TLI_225,äntlich emaal öppis für miich
d1082_3-TLI_226,das isch esoo öppis ganz märkwürdigs gsii
d1082_3-TLI_227,won ich hüt hüt nöd verschtaan aber
d1082_3-TLI_228,dasch öppis bioloogisches gsii
d1082_3-TLI_229,ch han das äifach wele ch han ä dä maa wele
d1082_3-TLI_23,es hät ä paar privaati ggää wo sich dänn aagschlosse händ
d1082_3-TLI_231,dä han ich imene tanzlokaal känegleert
d1082_3-TLI_232,es isch früener seer vil tanzet woorde
d1082_3-TLI_233,und das isch esoo öppis gsii woo üblich gsii isch
d1082_3-TLI_234,jaa ime tanzlokaal das tanzlokaal hät troggadeero
d1082_3-TLI_235,ghäisse und dä maa hät mier gfale
d1082_3-TLI_236,jaa und das er nach de leer ez äifach au käi arbet ghaa hät
d1082_3-TLI_237,da sind ebe die amerikaanische
d1082_3-TLI_238,produkt choo die punschprodukt und
d1082_3-TLI_239,dänn hät er halt au käi arbet ghaa
d1082_3-TLI_24,und äifach nöd vedunkled händ dänn
d1082_3-TLI_240,und sind
d1082_3-TLI_241,unvorschtelbaar arm gsii
d1082_3-TLI_242,i dären
d1082_3-TLI_243,jaa aso
d1082_3-TLI_244,was hät er gleert
d1082_3-TLI_245,er hät portföiee gleert
d1082_3-TLI_246,und hät aber soozsäge nie chönen uf dem pruef schaffe
d1082_3-TLI_247,hät är dänn nacher no arbet gfunde
d1082_3-TLI_249,so inere kartonaaschefabrik und
d1082_3-TLI_250,und emaal bi de im summer emaal bi de schtat uf
d1082_3-TLI_251,im schtraassebou
d1082_3-TLI_252,ja er hät scho no irgendwie arbet gfunden aber
d1082_3-TLI_253,äigentlich
d1082_3-TLI_254,jaa
d1082_3-TLI_255,wie lang händ si s dänn daa
d1082_3-TLI_256,so uf ängem ruum all mitenand uusghalte
d1082_3-TLI_257,ja äigentlich ebe nid guet
d1082_3-TLI_258,aso s isch esoo gsii das dänn
d1082_3-TLI_259,aso me händ dänn scho e chliises zimmer für öis ghaa
d1082_3-TLI_26,aso miir händ nöd chöne
d1082_3-TLI_260,und miin brüeder isch dänn uusgleert gsii
d1082_3-TLI_261,er hät e kaufmänischi leer gmacht
d1082_3-TLI_262,und är hät sich dänn sälbschtändig gmacht er isch dänn ines zimmer
d1082_3-TLI_263,und äis zimmer isch immer vermietet pliben i däre wonig
d1082_3-TLI_264,also miir händ aso würklich
d1082_3-TLI_265,uf ängschtem ruum gläbt
d1082_3-TLI_266,das häisst ich bin natüürlich
d1082_3-TLI_267,nach öppe zää wuche wider go schaffe
d1082_3-TLI_268,und zwaar han ich ä müese go schaffe
d1082_3-TLI_269,süsch het ich das verloore
d1082_3-TLI_27,daas i öisere laag hämmer sowisoo nid chöne
d1082_3-TLI_270,ja vilich bin i scho nach acht wuche wider ggange
d1082_3-TLI_271,in sankt annehoof
d1082_3-TLI_272,wämmer wider ggangen isch go schaffe
d1082_3-TLI_273,dänn hät mer au dä betraag überchoo
d1082_3-TLI_274,das isch deet scho gsii
d1082_3-TLI_275,dass fraue
d1082_3-TLI_276,me hät ene müsen e gwüssi ziit en loon zale
d1082_3-TLI_278,und dänn bin ich halt wider ggangen und
d1082_3-TLI_279,das chind hät müesen i d chrippe das isch en furchbaare schtress gsii
d1082_3-TLI_28,irgendöpis schpeziels
d1082_3-TLI_280,wo händ sii s i d chrippe praacht
d1082_3-TLI_281,d chrippen isch in wipkinge gsii am wipkingerplaz
d1082_3-TLI_282,das isch sovil ich wäiss hüt no
d1082_3-TLI_284,jaa und z aabig wider abgholt
d1082_3-TLI_286,jee nach verheltniss
d1082_3-TLI_287,also fröid händ s nüd ghaa a miir
d1082_3-TLI_288,wil ich bi dänn imer di letscht gsii
d1082_3-TLI_289,dänn das sind mäischtens fabrikarbäiterine
d1082_3-TLI_290,wo früener choo sind und d chind ä früener praacht händ
d1082_3-TLI_291,und ich bi halt dänn di letscht gsii dänn hät öpper müse deet bliibe
d1082_3-TLI_292,äggstra wäge miir wil iich s isch dänn sibni woorde
d1082_3-TLI_293,bis ich dänn deete gsi bin
d1082_3-TLI_295,aso si hät nattüürlich gliich no äiniges gmacht für miich
d1082_3-TLI_296,also me hät es isch scho nöd esoo das sii
d1082_3-TLI_297,aso ganz verärgeret gsii isch über mini situazioon
d1082_3-TLI_298,aber si hät natüürli ä gfunde ich het s äigendlich no chli schönner chöne haa
d1082_3-TLI_3,das isch nöitralitäät isch das gsii
d1082_3-TLI_300,die bezieig isch aso ganz
d1082_3-TLI_301,jaa das isch vor alem us finanzielle gründe wo käin gäld ist im haus
d1082_3-TLI_302,fliigt di liibe bald zum fänster hinaus
d1082_3-TLI_303,und dänn s groossi probleem isch natüürli ä gsii
d1082_3-TLI_304,aso ich han natüürli under käne umschtände nöd nomaal e zwäits chind wele
d1082_3-TLI_305,und i säbere ziit
d1082_3-TLI_306,het mer chuum hilf gfunde
d1082_3-TLI_307,wie händ si vehüetet
d1082_3-TLI_309,das isch me hät nüüt ghaa
d1082_3-TLI_31,mag i mii nöd erinnere mhm
d1082_3-TLI_310,zum verhüete isch ich ich het ez da nüüt gwüsst
d1082_3-TLI_312,und ich ha dä maa au gaar nüme wele
d1082_3-TLI_313,ich jaa ich han no gfunde i wot dä gaar nüme
d1082_3-TLI_314,das isch öppis problemaatisches gsii
d1082_3-TLI_315,ich ha jaa es isch sogaar esoo gsii
d1082_3-TLI_316,das ich gfunde han das chind isch ez daa und das isch miin mittelpunkt und
d1082_3-TLI_317,dä maa interesiirt miich äigendlich gaar nümen esoo grooss
d1082_3-TLI_318,und er isch er jaa s isch au
d1082_3-TLI_319,dänn esoo gsii
d1082_3-TLI_32,ab wänn sii und vilicht iiri umgäbig
d1082_3-TLI_320,miin brüeder isch dänn i de sozialistisch gsii
d1082_3-TLI_321,und är hät und ich ha gmärkt
d1082_3-TLI_322,daa ghöört ich äigendlich ane
d1082_3-TLI_323,und das isch öppis wo ich
d1082_3-TLI_324,vermisse
d1082_3-TLI_325,ha dänn aber gaar e kä ziit ghaa
d1082_3-TLI_326,und ich ha me händ dänn züglet
d1082_3-TLI_327,aso vesuecht z läbe inere äigene wonig
d1082_3-TLI_328,a de gasomeeterschtraass
d1082_3-TLI_329,aso ebe mit miim
d1082_3-TLI_33,dänn plözli en siig vo tüütschland fü möglich oder sicher ghalte
d1082_3-TLI_330,maa und
d1082_3-TLI_331,aso är im isch es natüürli au
d1082_3-TLI_332,ja är hät dänn äigendlich chönen uusgaa
d1082_3-TLI_333,und ich ha möse dehäim bliibe das isch eso das übliche gsii
d1082_3-TLI_334,wi lang händ si denn
d1082_3-TLI_336,jaa das ganzi hät öppe zwäi jaar tuuret
d1082_3-TLI_337,und dänn han ich
d1082_3-TLI_338,e besseri wonig gfunde und das huus
d1082_3-TLI_339,hät am jelmooli ghöört
d1082_3-TLI_34,jaa das blat händ siich gwändet ungefäär
d1082_3-TLI_340,und dänn bin ich deet ane züglet no mit im und das isch ganz churz gsii
d1082_3-TLI_341,won är no mit deet gwont hät
d1082_3-TLI_342,jaa und dänn han iich äifach gfunde aso
d1082_3-TLI_343,jez isch schluss ich wot dä maa nüme
d1082_3-TLI_344,und ich bi dänn zum fridensrichter
d1082_3-TLI_345,de fridesrichter isch im chräis vier gsi und dä han i zu dem fridesrichter gsäit
d1082_3-TLI_346,also sii ich chume da imer schlääg über vo dem maa
d1082_3-TLI_347,und ä süscht ich ich wot äifach ich wot dä maa nüme
d1082_3-TLI_348,und dänn hät dä zu miir gsäit
d1082_3-TLI_349,ja wüssed si da chöntemer die halb schtat züri schäide
d1082_3-TLI_35,mitte nünzehundertviereviirzg
d1082_3-TLI_350,aso wäge dem müend sii ez nöd
d1082_3-TLI_351,münd si ez nüd choo
d1082_3-TLI_352,und är trinkt ja süsch nööd und är isch ja süscht en ganz en aaschtändige was ja no gschtimt hät
d1082_3-TLI_353,jaa und me hät ja fasch imer gschafft er hät imer wider d schtell gwächslet aber
d1082_3-TLI_354,im grund gnoo jaa
d1082_3-TLI_355,sch är isch äiendlich gaar nöd esoo
d1082_3-TLI_356,ja s isch eso es hät vil so mane ghaa
d1082_3-TLI_357,dasch des isch en üblichs schiksaal gsii
d1082_3-TLI_358,da han i aber nöd lugglaa
d1082_3-TLI_359,und ha das gsäit näi das wird wiiterzoge
d1082_3-TLI_36,dänn hät mer irgendöppis mitüberchoo
d1082_3-TLI_360,und ha das wiiterzoge
d1082_3-TLI_361,dänn isch das öppe siben oder acht wuche ggangen oder no länger
d1082_3-TLI_362,bis mer dänn ändlich vor gricht händ chönen ärschiine
d1082_3-TLI_363,und deet sind sächs mane gsässe
d1082_3-TLI_364,und und ich jaa ich ha das ch han äifach gsäit ich
d1082_3-TLI_365,also für miich isch das
d1082_3-TLI_366,jaa für miich isch es abgschlosse und äär hät nöd wele schäide
d1082_3-TLI_367,und dänn hämmer nöd hämmer nöd chöne schäide
d1082_3-TLI_368,also s hät dänn es sind dänn no bemärkige gfalle
d1082_3-TLI_369,die hät doch en anderen und esoo
d1082_3-TLI_37,vo dem kataschtrofaale rükzuug
d1082_3-TLI_370,jaa eso i däm schtiil
d1082_3-TLI_371,ich bi dänn seer abwärtend behandlet woorde
d1082_3-TLI_372,und dänn isch jaa me händ nöd chöne schäide
d1082_3-TLI_373,aber ich ha ich ha dänn äifach nüme wele bi mit dem maa wone
d1082_3-TLI_374,und ha drum gsäit ez züglich züglich halt wider häi zu minere mueter
d1082_3-TLI_375,gotsnamen und
d1082_3-TLI_377,ja das wäär eso daas gsii
d1082_3-TLI_378,und ich ha dänn ä soo
d1082_3-TLI_379,wi langsam probiert
d1082_3-TLI_38,und das isch dänn vergliche woorde
d1082_3-TLI_380,wider echli en bekantechräis uufzboue en äigene
d1082_3-TLI_381,das isch dänn no so halbwägs möglich gsii mit arbetskoleegine
d1082_3-TLI_382,und eben au i das sozialistisch juged bin i dänn au emaal
d1082_3-TLI_383,wider ane anes si händ esoo träffe ghaa
d1082_3-TLI_384,das isch deet no gsii
d1082_3-TLI_385,woo ds volksrächt gsii isch deet hämmer sowiit ich mich ärinnere en ruum
d1082_3-TLI_386,ghaa das hät das roote zimmer ghäisse
d1082_3-TLI_387,aber ganz sicher bin i nüme
d1082_3-TLI_388,da gfunde daa ghöör ich anen und
d1082_3-TLI_389,jaa
d1082_3-TLI_39,mit em russlandfäldzuug aso dass wo d wo
d1082_3-TLI_390,dänn isch s dänn langsaam echli uufwärts ggange
d1082_3-TLI_391,jaa jaa ha mi wider wi me soo säit
d1082_3-TLI_392,ha mich wider so langsaam
d1082_3-TLI_393,ha gfunde das cha nöd mis läbe sii und
d1082_3-TLI_394,und ich bi mer voorchoo wie scho gschtorbe
d1082_3-TLI_395,also ich ha gfunde das cha nöd mis läbe sii eson e
d1082_3-TLI_396,eson e eson en
d1082_3-TLI_397,es lauft s isch ä nüüt gloffe
d1082_3-TLI_398,s isch mit däm maa
d1082_3-TLI_399,är wäär gaar nöd esoo
d1082_3-TLI_4,asoo das mer dass nöd wüssed wo d gränzen isch
d1082_3-TLI_40,jaa und das isch natüürli dänn
d1082_3-TLI_400,ich mus säge är im grund gnoo är isch en
d1082_3-TLI_401,en durchschnitliche mändsch
d1082_3-TLI_402,isch mer furchbaar langwiilig gsii
d1082_3-TLI_403,er hät ä nüüt gläse
d1082_3-TLI_404,und er hät au
d1082_3-TLI_405,ja aso nöd daas gläse won ich ha wele läse
d1082_3-TLI_406,es es s isch äifach esoo gsii
d1082_3-TLI_407,das es das ich äifach gfunde han da isch äifach nüüt me
d1082_3-TLI_408,s isch ja
d1082_3-TLI_409,wie hät das läbe als eläinerzieendi mueter so i de füfzgerjaar
d1082_3-TLI_41,ä mit em beresina-lied me händ isch dänn das beresina-lied gsunge woorde
d1082_3-TLI_410,uusgsee für sii
d1082_3-TLI_411,jaa das isch
d1082_3-TLI_412,aso das isch seer schwäär gsii
d1082_3-TLI_413,und vor alem us finanziele gründ es isch dänn esoo wiiterggange
d1082_3-TLI_414,das me siich immer wider hät möse säge
d1082_3-TLI_415,es isch ales nöd für diich ch
d1082_3-TLI_416,ich ha mer nämli praktisch nüüt chöne läischte
d1082_3-TLI_417,das häisst
d1082_3-TLI_418,ich ja ich ha mir äifach nüüt chöne läischte
d1082_3-TLI_419,ja ich han scho maal chönen ane tanzveraaschtaltig oder
d1082_3-TLI_42,und das das daa hämmer dänn öppis esoo mitüberchoo
d1082_3-TLI_420,ebe mit de sozialistisch juged emaal en uusfluug
d1082_3-TLI_421,das han i dä scho isch scho no möglich gsii
d1082_3-TLI_422,aber ich ha natüürli ä seer vil möse dehäim bliibe
d1082_3-TLI_423,wäg em chind obwool
d1082_3-TLI_424,ich ha dänn emaal e gwüssi ziit e frau gfunde gha wo das chind
d1082_3-TLI_425,ghüetet hät under de wuche also
d1082_3-TLI_426,und dänn am samschtig suntig wider abhole
d1082_3-TLI_427,aber ich
d1082_3-TLI_428,ich ha mi s isch wüklich es
d1082_3-TLI_429,äigendlich au en unvoorschtelbaari armuet gsii
d1082_3-TLI_43,aso vor alem bi kinderfröinde roote falken aber eventuell sogaar au i de schuel
d1082_3-TLI_430,und bi dene
d1082_3-TLI_431,won i dänn
d1082_3-TLI_432,eben ich bin dänn emaal i d partei und das han i ja
d1082_3-TLI_433,vorhär scho verzelt han äifach nöd passt zu dene fraue
d1082_3-TLI_435,jaa bi däre frauegruppe
d1082_3-TLI_436,was händ dänn die so gmacht
d1082_3-TLI_437,ja da isch chueche pachet woorde und glismet woorde
d1082_3-TLI_439,öppis politisches isch no gsii
d1082_3-TLI_44,i de dritte sekundaarschuel das jez daa
d1082_3-TLI_440,ich mag mi so ganz schwach
d1082_3-TLI_441,mag ich mich anen redekurs ärinnere
d1082_3-TLI_442,won ich aber ganz überforderet gsii bin
d1082_3-TLI_443,über s teema won ich het söle rede
d1082_3-TLI_444,jaa aber i wäiss nüme waas
d1082_3-TLI_445,und über dää das isch das isch gsii
d1082_3-TLI_446,ich mag mi scho no so schwach ärinnere
d1082_3-TLI_447,ane mascha ötli
d1082_3-TLI_448,woomer dänn won en
d1082_3-TLI_449,jaa ich bi dänn nöd mängsmaal ggange
d1082_3-TLI_45,e groossi groossi zämebruch
d1082_3-TLI_450,ich bi ich ha gfunde ich bi da denäbed
d1082_3-TLI_451,die fraue sind öppe
d1082_3-TLI_452,öppe zää die mäischte sind öppe föif zää jaar elter gsii als ich
d1082_3-TLI_453,und sind händ ali soozsäge ali en maa ghaa
d1082_3-TLI_454,wo sälber i de soziaaldemokraatische partei gsi isch
d1082_3-TLI_455,und gfunde hät d frau söll ez nur i die frauegruppe
d1082_3-TLI_456,und sind eso ame sind esoo aahängsel gsii vo mane
d1082_3-TLI_457,han ich gfunde
d1082_3-TLI_458,und was isch dä d konsekwenz gsii für sii
d1082_3-TLI_459,jaa dänn bin i äifach aso mim
d1082_3-TLI_46,aabaanet und das en rükzuug isch
d1082_3-TLI_460,bin i äifach wider uusträtte miin brüder isch seer entüüscht gsii
d1082_3-TLI_461,das ich ez wider uusträtte bin
d1082_3-TLI_462,jaa aber ich ha gsäit da han ich ez äifach nöd pass äifach nöd dahäre
d1082_3-TLI_463,und es isch au
d1082_3-TLI_464,au au wirtschaftlich es isch ich
d1082_3-TLI_465,ich ha gsäit au dä betraag isch mer no z vil
d1082_3-TLI_466,und ich mag mich no ärinnere
d1082_3-TLI_467,aso ich mag das ich zum bischpiil
d1082_3-TLI_469,jaa es isch mer dänn no öppis in sinn choo
d1082_3-TLI_47,und das hät me dänn au über de raadio mitüberchoo und au über d ziitige
d1082_3-TLI_470,am eerschte mäi bin ich emaal mitgloffe
d1082_3-TLI_471,mit de sozialistisch juged
d1082_3-TLI_472,und ich han das blau mir händ das blaui hämp dänn noch träit
d1082_3-TLI_473,so drüüefüfzg vierefüfzg
d1082_3-TLI_474,und s kampftüechli hämmer nüme träit
d1082_3-TLI_475,und dänn
d1082_3-TLI_476,won ich am andere taag go schaffe choo bin
d1082_3-TLI_477,hät en scheff zu miir gsäit
d1082_3-TLI_478,sii wisoo laufed si äigendlich am eerschte mäi mit de roote faanen umenand
d1082_3-TLI_479,hani da wäiss i nüme rächt was i gsäit han
d1082_3-TLI_48,me hät natüürli ä gwüsst dass daa
d1082_3-TLI_480,ich ha ich glaub ich ha gsäit
d1082_3-TLI_481,ich bi hinder de roote faane gloffe
d1082_3-TLI_482,oder transchparänt
d1082_3-TLI_483,me händ ä transchparänt ghaa
d1082_3-TLI_484,hinder em transchparänt mit däre gruppe
d1082_3-TLI_485,und das isch ime waarehuus
d1082_3-TLI_486,isch sowiit ich mich ärinnere sogar no e verordnig gsii
d1082_3-TLI_487,me betäätiget sich nöd
d1082_3-TLI_488,politisch also vilicht echli gselschaftspolittisch
d1082_3-TLI_489,aber nid äigendlich isch daas
d1082_3-TLI_49,i de schwiiz ofizieli naazi-veraaschaltige schtatfindet
d1082_3-TLI_490,ja nöd grad verbotte gsii aber s isch verpöönt gsii
d1082_3-TLI_492,jaa es hät es hät mich ä mitbewoge
d1082_3-TLI_493,und ich ha gfunde das bringt mir es bringt mir es bringt mir gaar nüüt daa ich
d1082_3-TLI_494,ich bi ich es isch würklich im ganze waarehuus hät sich überhaupt niemert
d1082_3-TLI_495,politisch bewegt
d1082_3-TLI_496,aso würkli nööd ich het nöd gwüsst
d1082_3-TLI_497,aso die wo junge wo sich polittisch ãgaschiirt händ das
d1082_3-TLI_498,mäischtens jungi gsii
d1082_3-TLI_499,won echli vomene ebe kaufmänische angeschtelti
d1082_3-TLI_5,und das nöd wüssed wo d schtat isch es isch äifach tunkel
d1082_3-TLI_50,und das han i aber nöd sälber mitüberchoo
d1082_3-TLI_500,und vor alem
d1082_3-TLI_501,aso scho purschte won e handwärklichi leer gmacht händ
d1082_3-TLI_502,aber es hät
d1082_3-TLI_503,dänn hät s schtudäntine ghaa
d1082_3-TLI_504,aber aso verchöiferine hät s
d1082_3-TLI_505,hät s kä ghaa aso so vome
d1082_3-TLI_506,vo miim schtand hät s kä ghaa
d1082_3-TLI_507,frau w*** ich wetti langsam zum schluss choo
d1082_3-TLI_509,bi de hüttige diskussione über d role vo de schwiiz wäred em zwäite wältchrieg
d1082_3-TLI_51,das naazi-faane us de fänschter ghanget woorde sind bis esoo
d1082_3-TLI_510,aso was ich dänke
d1082_3-TLI_511,über de zwäiti wältchrieg
d1082_3-TLI_513,über d diskussione
d1082_3-TLI_514,jaa miich tunkt s es chunt äifach öppe sächzg jaar z schpaat
d1082_3-TLI_515,oder füfzg maal vor alem daas
d1082_3-TLI_516,ich gsee de sinn nöd ganz ii
d1082_3-TLI_517,es isch ja ez ganz en anderi situazioon
d1082_3-TLI_518,aber es isch nöötig das mer das s isch gliich nöötig
d1082_3-TLI_519,das me das uufschafft dänn s isch äifach nie richtig uufgschafft woorde
d1082_3-TLI_52,ungefäär nünzehundertdreieviirzg
d1082_3-TLI_520,es es isch irgendwie
d1082_3-TLI_521,äifach so hinder de kulisse ghalte woorde
d1082_3-TLI_522,und das isch ja das woo miich
d1082_3-TLI_523,i de gschicht überhaupt eso schtöört
d1082_3-TLI_524,dass gschicht
d1082_3-TLI_525,aso biss vor öppe zwänzg jaar
d1082_3-TLI_526,isch es nu das ofizielle gsii
d1082_3-TLI_527,aber was hinder de kulisse gloffen isch wo vil wichtiger isch
d1082_3-TLI_528,das isch gaar nie uufgschafft woorde
d1082_3-TLI_529,und au das i de vor alem i de jugedbüecher oder i de
d1082_3-TLI_53,das hät me scho so halbe
d1082_3-TLI_530,ja es isch gaar nöd richtig s isch nu d helfti oder nöd emaal
d1082_3-TLI_531,s isch äifach nu daas fürechoo wo eso grad
d1082_3-TLI_532,üblich gsii isch und vor alem au
d1082_3-TLI_533,vorwiegend vo siite vo vo de mane aso nöd vo de fraue
d1082_3-TLI_534,das isch haupt gaar nie gfrööget gsii was fraue
d1082_3-TLI_535,erlitte oder erduldet händ
d1082_3-TLI_536,s sch gar nöd gfrööget gsii
d1082_3-TLI_537,ich ich wüsst jaa
d1082_3-TLI_538,und und das das es schtimt äifach nööd
d1082_3-TLI_539,und das mus ez
d1082_3-TLI_54,esoo mitüberchoo no so detäil
d1082_3-TLI_540,doch es mus s isch wichtig das es jez äigentlich äntlich
d1082_3-TLI_541,as liecht chunt
d1082_3-TLI_542,und vor aso was vor alem au isch
d1082_3-TLI_543,das au die armuet wo gsii isch
d1082_3-TLI_544,au i de schwiiz
d1082_3-TLI_545,das das gaar nie
d1082_3-TLI_546,zu schpraach choo isch
d1082_3-TLI_547,ich han arbetskoleegine ghaa
d1082_3-TLI_548,also wo e tüütschi oder ä süscht
d1082_3-TLI_549,wo das won iich gsäit han
d1082_3-TLI_55,jaa aber das isch äigendlich ales
d1082_3-TLI_550,si chönd sich nöd voorschtele
