Filename,Transcript
d1205-T555,isch das s erscht mòl ggsi dötä di begägnig mit dem tütschä wo si aso s isch s erscht mòl ggsi wo si vom konzentrazionslagòr ghört händ
d1205-T556,jò da isch s erscht mòl ggsi aso mä hät natürli scho immòr chli irgendöppis kört abòr
d1205-T557,ni so grauähaft wiä das wi dä da vòrzellt hät
d1205-T558,ich bi denn noch äm chriäg öppä
d1205-T559,zeen jòr nòch äm chriäg bin i ämòl sälbòr uf dachau hät mi au wundòr gnò äbän und denn han i dä film ggsee dört
d1205-T56,i irär väwantschaft nächärän umfäld so öppis passiärt isch
d1205-T561,dä isch kavalleriioberscht ggsi bim tütschä heer
d1205-T562,dä hät mich dört au iägfüärt mi sind mitänand gangä
d1205-T563,dä hät aso
d1205-T564,so indiräkt ä schuldbekenntnis gmacht vòr miär und hät ggsäit är schämi sich als tütschä dass äso öppis
d1205-T565,übòrhaupt vòrcho säi
d1205-T566,abòr si hettäd
d1205-T567,är glaubi aso wemmä da gwüsst hett in dütschland d wermacht hett nummä kämpft odòr da da das isch aso i dä weermacht värbòrgä blibän odòr
d1205-T568,und han ich ggsait
d1205-T569,mä cheni jez scho uurtailän übòr di tüütschän abòr är we är wett bloss sägä söll jedän im härrgott tankä wo i dänä zwölf jòr nöd in tütschland hai mösä läbä
d1205-T57,jò
d1205-T571,schiksal nöd inn tütschland häi mösä zuäbringä das sig also unärträglich ggsi odòr
d1205-T572,diä nazi haiäd aläs äso im griff kaa
d1205-T573,diä ganzä befräiig säi nur no vo ussä här möglich ggsi
d1205-T574,und drum hät äinfach dä chriäg mösä gò bis ganz tütschland kaputt ggsi isch und denn erscht denn isch färtig ggsi odòr
d1205-T575,wänn zum bischpil dört wo dä zwanzigschte juli passiòrt isch
d1205-T576,nünzähundòrtviäräviòrzg dää
d1205-T577,sogenannti schtaufänbärgisch attätat uf dä hitlòr i dä wolfschanzä z chaschtäborg
d1205-T578,wenn s dört glükt wär da dä hitlòr würkli troffä wordän isch
d1205-T579,wär
d1205-T58,i ha vilicht ämol än ärläbnis
d1205-T580,denn wär no fufzg prozänt vo tütschland wär nonig zärschtört ggsi
d1205-T581,vom zwanzigschtä juli nünzähundärtviäräviòrzg bis zum chriägsend am achtä mai nünzähundòrtfüfäviòrzg
d1205-T582,isch also no di zwait hälfti vo dä zärschtörigä händ schtatt gfundä
d1205-T583,und diä diä vòrtriibigän usäm oschtä diä
d1205-T584,diä furchtbarä menschäschiksal diä hettäd sich ali nummän abgschpillt
d1205-T585,ich wäiss no guät dò
d1205-T586,dò sind dòch immòr bombägschwadòr übòr unsòr huus gfaarän odòr
d1205-T587,haupzächlich znacht odòr
d1205-T588,damals sind jò
d1205-T589,flugzüg no nüd mit kompiutòr gschtüürät ggsi
d1205-T59,im jòòr nünzähundòrtsibänädriissg isch dä kantonale musigtag ggsi dä schaffusòr kantonale musigtag in ramsä
d1205-T590,denn hend sich di alliiòrtä bombòr vo dänn händ sich immòr am rii nòò mösän orientiòrä denn sind s am rii nòò uä gfaarä
d1205-T591,und denn
d1205-T592,wo si gsää händ ez chunnt dä bòdäsee
d1205-T593,ez isch dä rii färtig ez chunnt dä bòdäsee dänn sind s denn iri richtigä dänn sind s immòr dò am am rii nò uä chò und bi schtäi am rii sind s dänn iri
d1205-T594,beschtimmiggsòrt gflogä und mir händ dòch dò znacht immòr ganz
d1205-T595,bòmbòrubòrflüüg kaa noch und noch hä
d1205-T596,ich wäiss ämòl guät dää
d1205-T597,miòr händ ämòl turnä kaa
d1205-T598,vo elf bis zwölf
d1205-T599,am tag denn sind widòr bombòrvorbänd chò
d1205-T60,und
d1205-T600,aso dä himmäl äsoo schwarz
d1205-T601,win än muggäschwarm
d1205-T602,da chammòr sich aso hüt gar nöd vòrschtelä wo mä nur siät wenn hii und da ä flugzüg chunnt
d1205-T603,dä himmäl schwarz wi win än muggäschwarm vo bombòr
d1205-T604,alli mit totbringändòr lascht
d1205-T605,irää beschtimmungsort in tütschland gflogä sind hä
d1205-T606,ich cha mich no guät ärinnärä
d1205-T607,imm februar nünzähundòrtfüfäfiòrzg
d1205-T608,drai monät vor äm chriägsend
d1205-T609,isch
d1205-T61,dä musikvärain ramsä hät jò ou fründschaftlichi beziäigä zu allnä
d1205-T610,sind widòr d bombòrvòrbänd znacht durägflogä
d1205-T611,äin bombävòrband um dä andòr mä hät dört jò mösä vòrdunklä
d1205-T612,und dennä
d1205-T613,irgend zwanzg minutä schpötòr
d1205-T614,d lüüt sind dò
d1205-T615,zwanzg minutä schpötòr
d1205-T616,hät s äsoo irgänd ä schtimmig gää wi wänn s wüd
d1205-T617,tag wärdä
d1205-T618,wi am morgä im so im februar am morgän am sibni wenn s afangt dämmärä
d1205-T619,äs hät mä hät dä iidruk ka ez wird s tag odòr
d1205-T62,musikvärainä i dä umgebig
d1205-T620,und ez isch do schtai gfròòrä ggsi
d1205-T621,und mä hät halt so gmärkt d fenschtòrschiibä hönd ganz liòcht vibriòrt
d1205-T622,d lüt sind umänandgloffä wa isch ou passiòrt odòr
d1205-T623,am andòrä tag hät mä chönän idä nòchrichtä
d1205-T624,hörä än groossaagriff uf òugschburg
d1205-T625,mhm
d1205-T626,und aso òugschburg isch hundòrtacht
d1205-T627,kilometòr vo ramsän entfärnt aso gad sowiit wi vo ramsän uf bärn
d1205-T628,und mä cha sich vòrschtelä
d1205-T629,wa säb für ä füürhöll ggsi isch wenn mir uf hundòrtacht
d1205-T63,und denn hät mä diä òu igladä
d1205-T630,kilometòr gfüül ka hend s wird tag
d1205-T631,und d fänschtòrschiibä wibriòräd wa diä lüt händ mösä durämachä wo diä bombòrnächt durä-gschtandä sind hä
d1205-T633,händ si a befürchtät dass si dò
d1205-T634,chönntäd bombardiärt wärdä
d1205-T635,jò
d1205-T636,mä hät sich mä hät denn
d1205-T637,a dä gränzä nò hät mä dört immòr s schwiizòrchrüz ufgschtellt
d1205-T638,drissg mòl drissg metòr hät män ufm fäld
d1205-T639,hät mä s schwizòrchrüz ufgschtellt
d1205-T64,as kantonalfäscht dörtä zum mitmachä
d1205-T640,dass d bombòr ggsää händ vo obänabän odòr
d1205-T641,d schwiiz hät hauptsächlich dört übòr d bombardiärig vo schaffusän abä händ da d schwizòr välangt
d1205-T642,d amerikanòr hönd da välangt vo dä schwizòr si mösäd dò diä schwizerchrüz ufschtelä da bombòr vo obänabä sächäd wo si uf schwizòr
d1205-T644,und denn ussòr schtai am rii und schaffusän isch denn niä bòmbardiòrt worä
d1205-T645,z schtai am rii sind
d1205-T646,ufäm rükwäg hät ainä no ä paar bombä fallä lò abòr nöd diräkt aagriff uf schtai äs hät dört au öppä zwanzg toti ge und denn vòr alläm
d1205-T647,am erschtä april nünzähundòrtviäräviärzg z schaffusän unnä
d1205-T648,abòr säb isch au nöd än diräktä aagriff ggsi uf d schtat sondòrn ä bombägschwadòr wo zrugg gflògän isch hät nonig ali bombän abgworfä
d1205-T649,kaa
d1205-T650,und denn hönd si s aifach fallä lò übòr schaffusän abòr kan diräktän aagriff uf schaffusän abä
d1205-T651,mhm
d1205-T652,und denn s glük isch dört no ggsi
d1205-T653,im schtaiquartiòr
d1205-T654,das isch nur öppä füfhundòrt metòr vo dä
d1205-T655,geòrg fischòr wärk schtaalwärk
d1205-T656,wo dört d lüt ä d arbeit no gschafft händ am am samschtig odòr
d1205-T657,sägämòr ä ä sekundä früänòr wänn dä pilot ä sekundä früänòr uf dä bombänuslös trukt hett
d1205-T658,wäräd diä bombän uf s schtalwärk schaffusä hett tuusigi vo totä gee döt hä
d1205-T659,isch grauähaft ggsi do
d1205-T66,im jòòr nünzähundòrtsibänädriissg ich bi sibni ggsi
d1205-T660,wämä wämä sich tänkt wi schaffusä
d1205-T661,da isch öppis furchbars ggsi und däbii isch äs nöd ämòl än diräktä bombänagriff ggsi sondòrn äifòch bim übòrflug händ s no ä paar di räschtlichä bombä fallä lò
d1205-T662,dò muä mä sich vòrschtelä wänn dänä tütschä schtät wo si dò
d1205-T663,bewusst und geziilt
d1205-T664,bòmbardiòrt hend dat isch öppis furchbars ggsi für diä lüt da diä da hend mönän ushaltän odòr
d1205-T665,hät mär das dötän a scho so chönä so diffäränziärä aso d ez zum bischpil d lüt dò
d1205-T666,wo s ghört händ vo denää bombardiärig schtai am rii schaffusä
d1205-T667,das mä gfundä hät jò das isch ez nöd würklich än agriff sondern das isch jez halt päch ggsi
d1205-T668,nai s isch ainfach bim übòrflug di di räschtlichä bombän kaiä lò odòr
d1205-T67,und wo mä dänn wo dänn dä musikvärain ramsä diä iiladigä a alli umligändä tütschä väräinä vòschikt hät
d1205-T670,jò si si händ sich dänn wol entschuldigät d amerikanòr und händ dänn natürli
d1205-T671,dä ganzi schadänärsaz ufbròcht däfür abòr s hät glich toti gä und
d1205-T672,und
d1205-T673,ich wäiss nochòr mir händ jò ka phausä ka
d1205-T674,isch da gschwadòr übòr übòr ramsä gfaarä und dänn hät mä ggsä wo so dä dä lücht
d1205-T675,dä chrischbaum abälò hät
d1205-T676,komandoflugzüg odòr s söläd dò dä räscht no fallälò odòr
d1205-T677,und denn und denn im schaffusän unä jò dò hät mä schräklòchi nòchrichtä kört und mä sind denn am andòrä tag au abä
d1205-T678,und da isch unvòrschtellbar wi so wenigi bombä so vill unhail hend chönän aschtelä du
d1205-T679,we mä dratänkt bärlin
d1205-T68,hät dä bürgòrmaischtòr voo
d1205-T680,bärlin hät wärän äm chriäg zwaihundòrtzwanzgtuusig tonnä bombä lascht uf sich mösän abäkaiä lò wa diä lüt durägmacht händ
d1205-T681,z schaffuusä mit ä paar tuusig mit ä paar äinzälnä tonnä ä son än unhail agschtellt händ hä
d1205-T682,händ sii dihai aso vilicht iri muäter oder alläfalls a
d1205-T683,dä vatter won är dò ggsi isch oder si sälber igendwiä plän gmacht was wär wänn ezt wükich halt
d1205-T684,diä tütschän über diä gränzä chämtäd was was würd mä machä was händ si igendwiä tänkt si würdäd flüchtän oder
d1205-T685,mhm
d1205-T686,igenwiä zuäkunftsplän oder ängscht
d1205-T687,jò
d1205-T688,mä hät sich am schiksal ärgee abòr ich cha mich no guät ärinnorä dört
d1205-T689,im nünzähundòrtviòrzg
d1205-T69,dä nazionalsozialistischä bürgòrmaischtòr vo riälasingä hät vòrgüägt
d1205-T690,hät äinzelni ramsòr ka wo id innerschwiz gflüchtät sind zu vòrwantä
d1205-T691,abòr diä wo nid ä ka vòrwanti ka händ i dä innòrschwiz händ halt nöd chönä gò abòr mä hät sich halt
d1205-T692,mä hät halt äinfach tänkt wird hoffentlich nid schlimm choo drum mä hät sich mit äm schiksal abgä und zum glück isch äs niä chò odòr
d1205-T693,si händ voränä mal väzellt gha vo dem
d1205-T694,flüchtling wo dò ebä väzellt hät diä schreklichä gschichtä vom kaazätt händ si no anderi begegnigä mit flüchtling gha
d1205-T695,jò also
d1205-T696,jedä flüchtling isch ainfach is dorfchefi chò di erscht nacht mir sind ainfach als schüälòr amld um da dòrfchefi umägschtandän und am fänschtòr änä gschtandä
d1205-T697,sösch diräkt nüd odòr sind natürli
d1205-T698,relativ wänig iächo sägämòr wenn
d1205-T699,wenn vilich füfäzwanzg iächò sind wäräd äm ganzä chriäg isch da scho vill ggsi odòr
d1205-T7,jò härr n*** mir sind dò bi inä in ramsän und si händ sich berait ärklärt öis vo irnä ärinnärigä a zit vom zwaitä wältchriäg z väzelä
d1205-T70,di tütschä värainä törfäd nur
d1205-T701,da isch äbä wansinnig schtreng bewacht ggsi odòr s hät äinä scho ä chli mösä ortskundig sii odòr glück haa das äm d flucht glangän isch
d1205-T702,glükt isch odòr
d1205-T703,mhm
d1205-T704,si hend vorhär ärwänt s heg a sönig gha wo nöd tütsch händ chönä was sind denn das alläs so für lüt ggsi
d1205-T706,jò da sind a sötigi ggsii
d1205-T707,russä pholä wo vo dä i gfangäschaft chò sind so wo dä hitlòr
d1205-T708,pholä und d sowjetunion übòrfallä hät und dänn
d1205-T709,irgänd inä zwangsarbäitlagòr cho sind in tütschland und vo dò us d flucht glungän isch odòr
d1205-T71,a d a dä kantonale musigtag chò
d1205-T711,abòr denn am chriägszämäbruch
d1205-T712,iim
d1205-T713,ende april aso am achtä mai isch jò dä chriäg entgültig färtig ggsii so um dä zwanzigscht
d1205-T714,april sind d franzosän am rii nò unnän uä chò vo basel här hä und händ dò alläs bsezt und dört sind dänn di erschtä übòr
d1205-T715,übòrfüärigä ggsi
d1205-T716,vor alläm i denä zwangsarbäitslager händ s dänn diä tütschä händ dänn diä
d1205-T717,diä gschikt und
d1205-T718,id schwiz iä und hönd diä diä lagòr
d1205-T719,vor
d1205-T72,wenn d hitlòrfaanä mös vòruus
d1205-T720,gschprängt damit mä nid siät wiä s zuägangän isch dört odòr dört sind dänn zimmli flüchtling iächò
d1205-T721,mir händ dänn am änd vom zwaitä wältchriäg hämmòr äs abweerkompanii ka wo än wäidezaun um dä ganz
d1205-T722,um dä ganz bezirk schtäi am rii gmacht hät
d1205-T723,da diää flüchtling nöd wild chönd is dorf iä und denn isch ä ganzi kompanii isch dò ggsi und hät mösä bewachä da mä diä lüt hät chönän am zollamt zämäschlöisä
d1205-T724,und da sind a wuchä lang jedä tag sind dò vom morgä bis z òbed flüchtlingschtröm iächo gròuähaft du värwarlost und värnuusäd und värdräkäd und
d1205-T725,öppis furchtbars ggsi zum luägä hä
d1205-T727,dört sind s denn gluusät wordän und vo dört us sind s id innòrschwiiz chò und allmäläch widòr is usland abgschòbä wordä abòr öppis grauähafts ggsi zum zuäluägä
d1205-T728,aso si händ ez vorhär ggsait gha äs segi das isch s militär ggsi wo dò son än hòg baut hät um s dorf
d1205-T73,gfüòrt wärdä und uf äm fäschtplaz mös kisst wärdä
d1205-T731,a abòr nid wäg äm wäg wäg dä tüütschä wäg äm hitlòr sondòrn wäg dä flüchtling da mä das undòr kontrollä bròcht hät da diä flüchtling wo us tütschland id schwiz drängt händ nid wild händ chönän übärall iächò äso
d1205-T732,und dänn hät mä um s ganzä dorf umän än hag baut
d1205-T735,odòr wo d franzosä chò sind sind isch alläs id schwiz iä gflüchtät und da hät mä mösä undòr dä kontrollä bringä suscht wär da het da ä chaos gee odòr
d1205-T738,als schüälor isch mä mä hät natürli da züg au chönän aluägän odòr
d1205-T739,aimòl sind
d1205-T74,und dä händ natürli d ramsòr nöd vòrträit si händ ggsäit mir wänd aso kai hitlòrfaanä uf äm plaz odòr
d1205-T740,zum bischpil ggsii am horitmüäl
d1205-T741,dänn hät dä gaulaitòr wabnòr hät
d1205-T742,befolä singä mös vòrtaidigät wärdä
d1205-T743,aso bis zum letschtä schtäi mös da vòrtäidigät wärdä
d1205-T744,dört isch d bevölkärig vo singän und vo riälasingä händ au uf id schwiz iä gflüchtät wenn mä tänkt hät wenn s dò afangt kämpfän und d schtat si sind zu dä schtat uus chò
d1205-T745,sind uf ramsän iä chò zerscht im schüpplwald und nochär hät mä baid chilä hät mä gfüllt
d1205-T746,samaritòrvärain hät änä thee bròcht und diä wo im fraiä händ mösän übòrnachtä dänä hät mä wolldekänä bròcht odòr
d1205-T747,bis denn d franzosä singä
d1205-T748,und diä umligändä ortschaftä iignò händ odòr und dänn hät mä s händ s dänn widòr chönä zrugg odòr abòr
d1205-T749,dört wo mòr nonig gwüsst hät gòt dä füürhagl loos dört sind s halt au id schwiiz iä cho da isch logsch ggsi gäll
d1205-T750,mhm und händ si denn dò im gaschthus a lüt behärbärgt
d1205-T751,wiä
d1205-T752,bi inä dò im gaschthus händ si a lüt behärbärgt
d1205-T753,nai mir händ dört s militär ka diä s abweerkompanii
d1205-T754,im erschtä schtok hemmer no dä saal ka
d1205-T755,än saal wo
d1205-T756,wo
d1205-T757,d meerzwäkhallä nonig ggsi isch mir händ s ganz huus mit militär belait ka odòr
d1205-T758,flüchtling
d1205-T759,bi privatä lüt diä sind ali wo bäid chrichä sind voll ggsi di reformiärt und di katolisch
d1205-T76,wenn d hitlòrfaanä nöd au törfi mitcho und denn isch äs halt gangän ooni tütschi hä
d1205-T760,dänn im schüpplwald ussä gäll
d1205-T761,abòr mä hät diä lüt di ganz nacht betröit und da isch dört im
d1205-T762,diä händ det kämpiärt oder
d1205-T767,chaltä früälig ggsi
d1205-T768,mhm
d1205-T77,das händ si als chind als sibäjäärigä dò i dää baiz mitüberchoo
d1205-T770,jò mä hät denn das natürli no mösä wo vo ainòr siitä diä
d1205-T771,diä zwangsarbäiter id schwiiz iä gschlòist wordä sind und vo dä andärä siitä di tütschä bevölkerig
d1205-T772,hät mä denn natürli da mösä organisiärä das sich diä nöd krüzt händ süscht het jò da no rivalitätä gä wenn diä tütschä bevölkerig und diä flüchtlingschtröm ufänand gschtoossä wäräd odòr
d1205-T773,hät jò dä d gränzwacht und diä ding händ da mösä kòòrdiniärä da äimol diä dörfä durä und denn di andärä da diä nöd zämächò sind hä
d1205-T774,isch döt a dä diä zwangsarbäiter hettäd jò
d1205-T775,hettäd jò wuät übärchò und hettäd iri wuät abreagiärt a denä tütschä wò
d1205-T776,nöd ämòl öppis hend chönä däfüür am ganzä chaos odòr
d1205-T777,mhm
d1205-T778,und aso wänn ich das richtig väschtandä han isch chruz vor äm chriägsändi sind
d1205-T779,d lüt vo singä dò härä gflüchtät wäg dem aagriff
d1205-T780,und dänn isch dä chriäg dänn färtig ggsi und nachanä hät mär dò son än ä ä d gränzä befeschtigät gägä di andärä flüchtling dänn
d1205-T785,mhm und dä sind diä lüt döt am zollamt dänn aachoo
d1205-T786,und wo wiä isch denn das wiitergangä mit denä
d1205-T787,miär sind denn richtung hämmishofä
d1205-T788,dört isch ä grossuffangzält ggsi dört sind s entluusät wordän und ämòl vòrpflägt wordä
d1205-T789,und denn sind s id innòrschwiiz iächò und vo dört allmälòch widòr i iri haimatland
d1205-T790,zrugg
d1205-T792,wänn händ si s erschtmòl vo dä judäväfolgigä vo dä nazis ghört
d1205-T793,jò das isch
d1205-T794,voräm zwaitä wältchriäg
d1205-T795,dört vor alläm in singä
d1205-T796,hät so jüdischi gschäftslüt ka
d1205-T797,ä klaidòrgschäft
d1205-T798,dört wo dä hitlòr denn
d1205-T799,judävärfolgig öffäntlich proklamiòrt hät im viòrädrissgi
d1205-T80,sind si dänn als chind dò imm gaschthus vill ggsi händ si dò ghulfä schaffä oder wiä hät das uusggsee
d1205-T800,hät halt än huufä judä ka wo da nöd fürwòr ka händ
d1205-T801,än tail isch hät jò d scho gschaltän und isch id uässaa usgwandärät
d1205-T802,und diä wo dò nüd grad gangä sind diä sind denn praktisch di gfangnä ggsi dänä hät denn nüt me anders übrig blibä
d1205-T803,we übòr d gränzä id schwiz iä chò
d1205-T804,und denn hemmòr au ä famili ka vo singä
d1205-T805,und
d1205-T806,diä sind denn bim bi schlòssòr bim schlòssòrseppäl ussä sind diä öppän än mònät ggsii
d1205-T807,und denn hät s käissä si mössäd widòr usä
d1205-T808,und ich cha mich no guät ärinnärä
d1205-T809,wo mä diä lüüt ad gränzän usä
d1205-T81,wa mäinäd si
d1205-T810,usägfüärt hät hät s welä dä geschtapo übärgee
d1205-T811,hät ainfach ghaissä vo dä schwiiz si törfäd nöd i dä schwiz si si mösäd usä
d1205-T812,und denn hät mä diä lüt mit ämä mit ämä wagä hät mä dò ad gränzän usägfüärt und hät s wölä i dä ässäss übärgää und denn dò
d1205-T813,damals än leeròr schwiri und
d1205-T814,dä isch eng befründät ggsi mit äm schtatpräsidänt brendolf vo schaffusä
d1205-T815,diä hönd s dänn färtigbròcht dass aso dass si nöd hend mösä gò
d1205-T816,sind also öppä no fufzg meter vo dä gränzä ggsi d ässäss und geschtapo hät scho gwartät zum in empfang nää und denn isch dä
d1205-T817,leeròr schwiri mitäm mit äm welo usägfaarä undhät ggsäit
d1205-T818,sòfòrt umcheerä
d1205-T819,dänn händ s dänn dörfän idä schwiiz sii jò da isch öppis furchbars ggsii wi diä lüt brüälät hönd und zittärät hönd uf äm wagän obän odòr wo si widòr händ mösän usä hä
d1205-T820,und wiso hät dä das hät dää hät dänn dää
d1205-T821,igendwiä ofizielli ärlaubnis gha dass är dänä lüt ez cha sägä si chönd dänn dò bliibä
d1205-T822,dä leerär
d1205-T823,är hät halt mit äm schtatpräsidänt brendolf hät är dò
d1205-T824,abòr da isch für miòr buäbä sind dört hindòr dem wagä nògloffä und händ welä luägä wi diä i dä ässäss abgää wärdäd diä lüt hend zittòrät und prüälät ufäm wagän obä odòr
d1205-T826,und fufzg meter vorhär häz kaissä also no dò sii da isch ä furchbar ärläbniss ggsi hä
d1205-T828,jò dört bin i
d1205-T830,wi händ si dò aso was was sind so iri gfüül dò däbii ggsi was händ si gmacht als chind i därä aso da isch jò ä wansinnigi situazion
d1205-T831,jò wämmòr diä lüt hät ggsää hä wi diä fäzwiiflät uf äm wagä ggsi sind und brüälät händ da isch für üs chlini buäbän ä furchbar ärläbnis ggsi odòr
d1205-T832,dä furmaa immòr glich zuägfaarä isch hä und si
d1205-T833,und da sind a chind däbii ggsi oder döt nò
d1205-T834,bi denää wo usgfüärt wordä sind bi därä familiä
d1205-T835,isch ä familiä mit chind ggsi
d1205-T836,jò familiä mit chind
d1205-T838,d ässäss und geschtapo isch scho perat ggsi zum in epfang nää hä
d1205-T839,isch dä leeròr schwiri no mit äm welo usägfaarä und hät ggsait schtopp umcheerä hä da git s nöd hä
d1205-T84,häjò mir händ im partär isch s gschäft ggsi bekärai und und s reschtorand
d1205-T840,isch är isch dä leerer schweri nochär für si chli än held ggsi wägä dem oder
d1205-T841,jò äs isch halt scho än humanischg ggsi än
d1205-T842,grossä humanischg gäll
d1205-T843,musikalisch hochbegòbt und
d1205-T844,isch scho öppor ggsi gäll
d1205-T845,händ si dänn
d1205-T846,mit denä chind vo därä familiä händ si als chind
d1205-T847,mit denä gret oder gschpillt oder ztuä gha
d1205-T848,wänigòr wänigòr dò simmòr nid däzuä chò hä
d1205-T849,diä händ sich immòr ächli abgschottät odòr sind niä
d1205-T85,im erschtä schtok hemmòr dä saal ka praktisch ä ä wònschtubä hämmär käini ka dänn hät mär sich ainfach dò ufghaltän und hät
d1205-T850,diä chind sind jò diä sind nur öppä
d1205-T851,än mònät odòr zwee mònät dò ggsi diä sind nöd z ramsän id schuäl odòr und si händ sich immòr dischtanziärt vo alläm gäll
d1205-T853,händ si dò i dä schwiz jüdischi lüt kännt
d1205-T854,näi wiitòrs ussòrt dänä nid hä
d1205-T856,mhm
d1205-T857,händ dänn iri väwantä händ sachä väzellt vo
d1205-T858,denä judäväfolgigä aso det no vor äm chriäg wo si jò no händ chönä
d1205-T86,und bsundòrs wänn s wänn ich denn widòr gmärkt ha dass im reschtorand i dä gaschtschtubä übòr da theemaa
d1205-T860,wa miòr vo dä väwantä
d1205-T861,händ
d1205-T862,wänn irgendainä sich politisch gägä dä hitlòr ufglent händ isch äifach am andärä tag
d1205-T863,ain oder zwai tag schpöter isch är vo dä ässäss und vo dä geschtapo abkollt wordän und furt dò hät mä nünt me kört vo imm
d1205-T864,mhm
d1205-T865,undòrtaucht färtig
d1205-T867,jò di politisch missliäbigä
d1205-T868,und aber vo jüdischä lüt wo ez afach wägä dem väfolgt wordä sind händ diä a öppis väzellt
d1205-T87,gret wordän isch denn han ich mich immòr grad widòr
d1205-T870,diä sind irgendwo undòrtaucht imnä konzentrazionslagòr
d1205-T871,und was isch d reakzion vo irnä väwantän uf das ggsi
d1205-T872,jò
d1205-T873,innòrlich hät mä scho ä wuät ka abòr mä hät nüt törfä sägä suscht wärmän au draachò odòr
d1205-T874,mhm mhm
d1205-T876,ez mus i nomòl än schprung machä zu andärnä themänä
d1205-T877,wo irä vatter dänn is militär hät müsä
d1205-T878,was hät das für si dò dihai bedütäd
d1205-T879,was hät gändärät was isch
d1205-T88,hindòr s büffe gmacht zum au losä wa diä väzelläd da hät mich damals als chlinä buäb scho fasziniärt odòr
d1205-T880,vilicht hät s schwirikatä gää ich waiss äs nöd
d1205-T881,jò
d1205-T882,d muätòr hät jò no än bek ka gäll dä hät no ächli bachä s familiäläbä isch sowiit scho isch äinfach oni dä vattòr gloffä wiä wännòr durch tod au nummä dò ggsi wär odòr
d1205-T883,mä isch id schuäl und isch hai chò gò ässä und hät mösä hälfä schaffän odòr
d1205-T884,mhm
d1205-T885,aso sii si händ dä s isch dänn öpper agschtellt wordä zum d arbät
d1205-T887,dä isch dozmòl scho viòräsibäzg
d1205-T888,ggsi wo dä chriäg usbròchän isch und hät denn welä in ruheschtand inän altòrshaim
d1205-T889,und wo den dä vattòr hät mösän in in
d1205-T890,militärdiänscht hät s natürli ghaissä du muäsch ez dò bliibä miòr chönd dich nid
d1205-T891,du muäsch halt dò bliibä gäll
d1205-T892,bis nòch äm chriäg isch òr denn natürli denn scho übòr achzgi ggsi gäll abòr
d1205-T893,hät natürli gschafft wiä s gangän isch odòr dää
d1205-T894,und denn vor alläm
d1205-T895,wäräd äm zwaitä wältchriäg
d1205-T896,hät mä käi
d1205-T897,s brännmaterial isch reduziärt wòrdä
d1205-T898,zerscht wo dä chriäg usbròchän isch
d1205-T899,hä dä vattòr hät doch än holz und cholän ofä ka
d1205-T9,ich schlan vor si fanged gad mal aa i däm si öis väzeläd jò wo und wänn si geborä sind und wi si ufgwachsä sind
d1205-T90,diä dòrfbewoonòr vo ramsä
d1205-T900,s koläkontingänt isch gad uf än drittäl kürzt wòrdä
d1205-T901,und denn
d1205-T902,hät s käissä
d1205-T903,s git aifach nöd mee mönd sälbòr luägä wonnòr òiä holz findäd
d1205-T904,und denn noch äm frankrichfäldzug ischòr sogar no ufän viòrtäl kürzt wòrdä
d1205-T905,da isch gad so vill ggsi
